AK00403249,Buch,"Finckh, Ludwig (1876-1964) [Verfasser/Urheber]",,Stern und Schicksal : Johann Keplers Lebensroman,"Finckh, Ludwig","Stuttgart ; Berlin : Dt. Verl.-Anst., 1931 - 280 Seiten",Deutsche Verlags-Anstalt,Stern und Schicksal,Johann Keplers Lebensroman,erzählt von Ludwig Finckh,,Stuttgart ; Berlin,Dt. Verl.-Anst.,1931,1931,,280 Seiten,,,,Mit gedr. Widmung für Robert Bosch␟Erstausg. - In Fraktur,,,,Deutsch,,,K␟K,
AK01234056,Buch,"Fischer, Bernd Erhard (1948-) [Verfasser/Urheber]","Fischer, Angelika (1947-) [Illustrator]",Alfred Kubin in Zwickledt - 1. Aufl.,"Fischer, Bernd Erhard; Fischer, Angelika","Berlin : Ed. Fischer, 2008 - 31 Seiten",Ed. A. B. Fischer,Alfred Kubin in Zwickledt,,Text: Bernd Erhard Fischer. Photographien: Angelika Fischer,1. Aufl.,Berlin,Ed. Fischer,2008,2008,,31 Seiten,zahlr. Ill.,Menschen und Orte,,,978-3-937434-24-7,,,Deutsch,,,KK:Kps.,
AK01358970,Buch,"Fischer, Bernd Erhard (1948-) [Verfasser/Urheber]","Fischer, Angelika (1947-) [Illustrator]",Marie Luise Kaschnitz in Bollschweil - 1. Aufl.,"Fischer, Bernd Erhard; Fischer, Angelika","Berlin : Ed. A. B. Fischer, 2013 - 31 Seiten",Ed. A. B. Fischer,Marie Luise Kaschnitz in Bollschweil,,Text: Bernd Erhard Fischer. Photogr.: Angelika Fischer,1. Aufl.,Berlin,Ed. A. B. Fischer,2013,2013,,31 Seiten,zahlr. Ill.,Menschen und Orte,,,978-3-937434-53-7,,,Deutsch,,,LL:Kps.,
AK01808425,Buch,"Fischer, Cornelius (1951-2020) [Verfasser/Urheber]",,"Russian Tearoom, Berlin : Roman","Fischer, Cornelius","Wien : Thiele & Brandstätter Verlag, 2023 - 320 Seiten",Thiele,"Russian Tearoom, Berlin",Roman,Claus Cornelius Fischer,,Wien,Thiele & Brandstätter Verlag,2023,2023,,320 Seiten,,,,,9783851795431,,,Deutsch,,,,
AK00567861,Buch,"Fischer, Ernst (1899-1972) [Verfasser/Urheber]",,¬Die¬ Entstehung des österreichischen Volkscharakters,"Fischer, Ernst","Wien : Neues Österreich, Zeitungs- u. Verl.-gesellschaft, 1945 - 45 Seiten",,Die Entstehung des österreichischen Volkscharakters,,von Ernst Fischer,,Wien,"Neues Österreich, Zeitungs- u. Verl.-gesellschaft",1945,1945,,45 Seiten,,Schriftenreihe Neues Österreich ; 2,2,,,,,Deutsch,,,Glück:L,
AK00823549,Buch␟Buchumschlag,"Fischer, Gerhard (1949-) [Verfasser/Urheber]",,¬Die¬ Planetenbauerin und andere kurze Texte - 1. Aufl.,"Fischer, Gerhard","Frankfurt/M. : G. Fischer [Selbstverl.], 1979 - 63 Seiten",,Die Planetenbauerin und andere kurze Texte,,Gerhard Fischer,1. Aufl.,Frankfurt/M.,G. Fischer [Selbstverl.],1979,1979,,63 Seiten,,,,Pp. : DM 9.80,,,,Deutsch,,,M,
AK01765900,Buch,"Fischer, Julius (1984-) [Verfasser/Urheber]",,Ich hasse Menschen : eine Art Liebesgeschichte - 2. Auflage,"Fischer, Julius","Berlin ; Dresden : Voland & Quist, 2022 - 271 Seiten",Voland & Quist,Ich hasse Menschen,eine Art Liebesgeschichte,Julius Fischer,2. Auflage,Berlin ; Dresden,Voland & Quist,2022,2022,,271 Seiten,,,,,978-3-86391-282-6,Erzählende Prosa,,Deutsch,,,N,
AK01196168,Buch,"Fischer, Theodor (1872-1925) [Verfasser/Urheber]",,Vom Wirken und Werten : [Aussprüche aus Reden und Schriften],"Fischer, Theodor","München : VonFicht, 1946 - 30 Seiten",,Vom Wirken und Werten,[Aussprüche aus Reden und Schriften],Theodor Fischer,,München␟München,VonFicht␟Drei-Eichen-Verl.,1946,1946,,30 Seiten,Ill.,Geistiges München ; 4,4,,,,,Deutsch,,,S14.5:Kps.,
AK01531711,Buch,"Fitzbauer, Erich (1927-) [Verfasser/Urheber]␟Leskoschek, Axl (1889-1976) [Künstler]",,"Axl Leskoschek und seine Buchgraphik : mit einer Bibliographie, einem Originalholzschnitt und 21 Originallinolschnitten zu zwei Romanen von Dostojewski","Fitzbauer, Erich; Leskoschek, Axl","Wien : Edition Graphischer Zirkel, 1979 - [48] Seiten",Ed. Graph. Zirkel,Axl Leskoschek und seine Buchgraphik,"mit einer Bibliographie, einem Originalholzschnitt und 21 Originallinolschnitten zu zwei Romanen von Dostojewski",Erich Fitzbauer,,Wien,Edition Graphischer Zirkel,1979,1979,,[48] Seiten,zahlreiche Illustrationen,Buchpublikation der Edition Graphischer Zirkel ; 10,10,"400 numerierte und vom Autor signierte Exemplare.  Den Exemplaren 1 - 5 wurde je 1 separate Folge aller 22 Graphiken in Handdruck auf Japan, sämtlich  mit Nachlassstempel, in Mappen beigegeben",3-900308-08-X,Sonstige Texte,,Deutsch,,"Der ewige Gatte, Der Spieler : zwei Linolschnittzylen zu Romanen von Dostojewski",M,
AK00394208,Buch,"Flaischlen, Cäsar (1864-1920) [Verfasser/Urheber]",,"Graphische Litteratur-Tafel : die deutsche Litteratur und der Einfluß fremder Litteraturen auf ihren Verlauf, vom Beginn einer schriftlichen Ueberlieferung an bis heute ; in graphischer Darstellung","Flaischlen, Cäsar","Stuttgart : Göschen, 1890 - 1 Faltbl.",Göschen,Graphische Litteratur-Tafel,"die deutsche Litteratur und der Einfluß fremder Litteraturen auf ihren Verlauf, vom Beginn einer schriftlichen Ueberlieferung an bis heute ; in graphischer Darstellung",von Cäsar Flaischlen,,Stuttgart,Göschen,1890,1890,,1 Faltbl.,,,,,,,,Deutsch,,Graphische Literatur-Tafel,K,
AK00420023,Buch,"Flaischlen, Cäsar (1864-1920) [Verfasser/Urheber]",,"Jost Seyfried : ein Roman in Brief- und Tagebuchblättern ; aus dem Leben eines Jeden ; Sprüche eines Steinklopfers, Sturmbruch, Lieder eines Schwertschmieds, Herzblut, Tor auf!. - 2. - 118. - 120. Tsd.","Flaischlen, Cäsar","Berlin : Fleischel, 1924 - 111, 110, 107 Seiten",,,,,118. - 120. Tsd.,,,1924,1924,,"111, 110, 107 Seiten",,,2,Enth.: 3. Buch: Lieder eines Schwertschmieds. 4. Buch: Herzblut. 5. Buch: Tor auf!,,,,Deutsch,,,K,
AK00406043,Buch,"Flaischlen, Cäsar (1864-1920) [Verfasser/Urheber]",,Mandolinchen Leierkastenmann und Kuckuck : ein Liederbuch von Sehnsucht und Erfüllung - Erste Auflage,"Flaischlen, Cäsar","Berlin : Fleischel, 1921 - 155 Seiten",Fleischel,Mandolinchen Leierkastenmann und Kuckuck,ein Liederbuch von Sehnsucht und Erfüllung,Cäsar Flaischlen,Erste Auflage,Berlin,Fleischel,1921,1921,,155 Seiten,,,,Die erste Auflage wurde auf handgeschöpftem Büttenpapier gedruckt und numeriert,,Lyrik,,Deutsch,,,K,
AK00405940,Buch,"Flaischlen, Cäsar (1864-1920) [Verfasser/Urheber]",,Perkeolieder : dem Heiligen und seinen Jüngern zum 10. Stiftungsfest ; am 2. und 3. Juni 1894,"Flaischlen, Cäsar","Heidelberg : Hörning, 1894 - 24 Seiten",Hörning,Perkeolieder,dem Heiligen und seinen Jüngern zum 10. Stiftungsfest ; am 2. und 3. Juni 1894,"Cäsar Flaischlen. [Hrsg. von] Perkeo, Verein Jüngerer Buchhändler Heidelberg",,Heidelberg,Hörning,1894,1894,,24 Seiten,,,,,,,,,,,K␟K:Kps.␟K:Kps.,
AK00406045,Buch,"Flaischlen, Cäsar (1864-1920) [Verfasser/Urheber]",,Spruchlied Luthers : ein Lied vom deutschen Leide ; Sonderdruck zu des Dichters 57. Geburtstag am 12. Mai 1921 - [Privatdr.],"Flaischlen, Cäsar","[s. l.] : [s. n.], [1921] - 4 Seiten",,Spruchlied Luthers,ein Lied vom deutschen Leide ; Sonderdruck zu des Dichters 57. Geburtstag am 12. Mai 1921,Cäsar Flaischlen,[Privatdr.],[s. l.]␟[Offenbach a. M.],[s. n.]␟[Karl Klingspor],[1921],1921,,4 Seiten,mit 1 Abb.,,,,,,,,,,K:Kps.,
AK00406047,Buch,"Flaischlen, Cäsar (1864-1920) [Verfasser/Urheber]",,Von derhoim ond draußa : Dichtungen in schwäbischer Mundart ; mit einer Handzeichnung Flaischlens,"Flaischlen, Cäsar","Stuttgart : Dt. Verl.-Anst., 1924 - o.A.",Deutsche Verlags-Anstalt,Von derhoim ond draußa,Dichtungen in schwäbischer Mundart ; mit einer Handzeichnung Flaischlens,Cäsar Flaischlen,,Stuttgart,Dt. Verl.-Anst.,1924,1924,,o.A.,,,,,,,,,,,K,
AK00330650,Buch,"Flake, Otto (1880-1963) [Verfasser/Urheber]",,¬Die¬ Romane um Ruland. - 1. ¬Eine¬ Kindheit - 8. - 10. Aufl.,"Flake, Otto","Berlin : Fischer, 1928 - 266 Seiten",,Eine Kindheit,Roman,,8. - 10. Aufl.,,,1928,1928,,266 Seiten,,,1,"Endgültige Fassung des Romans ""Freitagskind""",,,,Deutsch,,,L,
AK01370065,Buch␟Buchumschlag,"Flake, Otto (1880-1963) [Verfasser/Urheber]","Weiß, Emil Rudolf (1875-1942) [Illustrator]",¬Die¬ Töchter Noras : Roman - 1. - 4. Aufl.,"Flake, Otto; Weiß, Emil Rudolf","Berlin : Fischer, 1934 - 394 Seiten",S. Fischer,Die Töchter Noras,Roman,Otto Flake. [Einband und Schutzumschlag: E. R. Weiß],1. - 4. Aufl.,Berlin,Fischer,1934,1934,,394 Seiten,,,,In Fraktur,,Erzählende Prosa␟Nichttextuelle Produktion,,Deutsch,,,L␟BKP4,
AK00568024,Mehrteiliges Werk,"Flake, Otto (1880-1963) [Verfasser/Urheber]",,Fortunat,"Flake, Otto",Baden-Baden : Keppler,Keppler,Fortunat,,Otto Flake,,Baden-Baden,Keppler,,,,,,,,,,Erzählende Prosa,,Deutsch,,,,
AK00568017,Buch,"Flake, Otto (1880-1963) [Verfasser/Urheber]",,Große Damen des Barock - 1. - 5.Aufl.,"Flake, Otto","Berlin : Fischer, 1939 - 365 Seiten",S. Fischer,Große Damen des Barock,,Otto Flake,1. - 5.Aufl.,Berlin,Fischer,1939,1939,,365 Seiten,,,,,,,,Deutsch,,,L,
AK01035401,Buch,"Flatter, Richard (1891-1960) [Verfasser/Urheber]",,William Shakespeare: Hamlet - 5. Aufl.,"Flatter, Richard","Frankfurt [u.a.] : Diesterweg, 1975 - 66 Seiten",Diesterweg,William Shakespeare: Hamlet,,von Richard Flatter,5. Aufl.,Frankfurt [u.a.],Diesterweg,1975,1975,,66 Seiten,,Grundlagen und Gedanken zum Verständnis klassischer Dramen,,,3-425-06386-3,,,Deutsch,,,QHH3,
AK01444270,Buch␟Buchumschlag,"Flender, Karl W. (1986-) [Verfasser/Urheber]",,"Greenwash, Inc. : Roman - 1. Aufl.","Flender, Karl W.","Köln : DuMont, 2015 - 391 Seiten",DuMont,"Greenwash, Inc.",Roman,Karl Wolfgang Flender,1. Aufl.,Köln,DuMont,2015,2015,,391 Seiten,,,,,978-3-8321-9764-3,Erzählende Prosa,,Deutsch,,,N,
AK00568190,Buch,"Flex, Walter (1887-1917) [Verfasser/Urheber]","Eggert-Windegg, Walther (1880-1936) [Herausgeber]",Briefe von Walter Flex - 7. - 13. Tsd. : [Brief(e)],"Flex, Walter; Eggert-Windegg, Walther","München : Beck, [1927] - VI, 332 Seiten",Beck,Briefe von Walter Flex,,in Verb. mit Konrad Flex hrsg. von Walther Eggert-Windegg,7. - 13. Tsd.,München,Beck,[1927],1927,,"VI, 332 Seiten",Ill.,,,#NV␟In Fraktur,,,Brief(e),Deutsch,,,L,
AK00568173,Buch,"Flex, Walter (1887-1917) [Verfasser/Urheber]",,Vom großen Abendmahl : Verse und Gedanken aus dem Feld - 121. - 125. Tsd.,"Flex, Walter","München : Beck, [nach 1925] - 49 Seiten",Beck,Vom großen Abendmahl,Verse und Gedanken aus dem Feld,von Walter Flex,121. - 125. Tsd.,München,Beck,[nach 1925],1925,,49 Seiten,,,,#NV␟In Fraktur,,,,Deutsch,,,L,
AK00823732,Buch,"Flieger, Jan (1941-) [Verfasser/Urheber]",,¬Der¬ Tod kam in der Mittsommernacht - 1. Aufl.,"Flieger, Jan","Berlin : Militärverl. d. DDR, 1988 - 192 Seiten",Militär-Verl. der DDR,Der Tod kam in der Mittsommernacht,,Jan Flieger,1. Aufl.,Berlin,Militärverl. d. DDR,1988,1988,,192 Seiten,,,,kart. : M 3.80,3-327-00582-6,,,Deutsch,,,M,
AK01771109,Buch␟Buchumschlag,"Flinker, Robert (1906-1945) [Verfasser/Urheber]","Kittner, Alfred (1906-1991) [Korrespondent]␟Lauscher, Ernst Josef (1947-) [Verfasser eines Vorworts]␟Krug, Adrian [Herausgeber]",Ferner Berge blauer Glanz : Gedichte : [Werke Sammlung],"Flinker, Robert; Kittner, Alfred; Lauscher, Ernst Josef; Krug, Adrian","Aachen : Rimbaud, © 2021 - 27 Seiten",Rimbaud,Ferner Berge blauer Glanz,Gedichte,Robert Flinker ; mit einem Brief von Alfred Kittner und einem Nachwort von Ernst Josef Lauscher ; herausgegeben von Adrian Krug,,Aachen,Rimbaud,© 2021,2021,,27 Seiten,,Lyrik-Taschenbuch ; Nr. 127␟Bukowiner Literaturlandschaft ; Nr. 98,Nr. 127␟Nr. 98,,978-3-89086-422-8␟3890864228,Lyrik,Werke Sammlung,Deutsch,,,L,
AK01583116,Buch,"Floehr, Johannes (1991-) [Verfasser/Urheber]",,Fragen,"Floehr, Johannes","[Düsseldorf] : Zakk, 2017 - [12] Seiten",Zakk,Fragen,,Johannes Floehr,,[Düsseldorf],Zakk,2017,2017,,[12] Seiten,,,,,,Sonstige Texte,,Deutsch,,,Literaturautomat:Rara:2017.09553,
AK01704016,Buch,"Flügge, Manfred (1946-) [Verfasser/Urheber]","Bondy, Camille [Widmungsempfänger]","¬Das¬ flüchtige Paradies : deutsche Schriftsteller im Exil an der Côte dAzur - Erweiterte Ausgabe, 1. Auflage","Flügge, Manfred; Bondy, Camille","Berlin : atb Aufbau Taschenbuch, 2019 - 311 Seiten",Aufbau-Taschenbuch-Verl.,Das flüchtige Paradies,deutsche Schriftsteller im Exil an der Côte dAzur,Manfred Flügge,"Erweiterte Ausgabe, 1. Auflage",Berlin,atb Aufbau Taschenbuch,2019,2019,,311 Seiten,Illustrationen,atb ; 3579,3579,"Erweiterte Ausgabe des 2008 im Aufbau Taschenbuch Verlag erschienenen Bandes ""Das flüchtige Paradies. Künstler an der Côte d'Azur""␟Mit gedruckter Widmung an Camille Bondy",978-3-7466-3579-8,Sonstige Texte,,Deutsch,,,M,
AK01563669,Buch,"Flügge, Manfred (1946-) [Verfasser/Urheber]","Rupp, Annette [Herausgeber]␟Villa Aurora e.V. [Herausgebendes Organ]","Fry, Bingham, Sharp : die amerikanischen Retter von Lion und Marta Feuchtwanger","Flügge, Manfred; Rupp, Annette; Villa Aurora e.V.","Berlin : Villa Aurora, © 2016 - 75 Seiten",Villa Aurora Forum,"Fry, Bingham, Sharp",die amerikanischen Retter von Lion und Marta Feuchtwanger,Manfred Flügge,,Berlin,Villa Aurora,© 2016,2016,,75 Seiten,Illustrationen,,,,,Sonstige Texte,,Deutsch␟Englisch,,,M,
AK01337315,Buch,"Focke, Ann-Christin (1983-) [Verfasser/Urheber]",,Unterwerfung und Widerstreit : Strukturen einer neuen politischen Theaterästhetik : [Hochschulschrift],"Focke, Ann-Christin","München : Utz, 2011 - 255 Seiten",Utz,Unterwerfung und Widerstreit,Strukturen einer neuen politischen Theaterästhetik,Ann-Christin Focke,,München,Utz,2011,2011,,255 Seiten,,Münchener Universitätsschriften : Theaterwissenschaft ; 19,19,"Zugl.: München, Univ., Diss., 2011",978-3-8316-4074-4␟3-8316-4074-2,Sonstige Texte,Hochschulschrift,Deutsch,,,S5,
AK00568334,Buch,"Foitzick, Walter (1886-1955) [Verfasser/Urheber]",,Münchener Spaziergänge,"Foitzick, Walter","[München] : Heimeran, 1948 - 111 Seiten",Heimeran,Münchener Spaziergänge,,Walter Foitzick,,[München],Heimeran,1948,1948,,111 Seiten,,,,Pp. : 5.-,,,,Deutsch,,,J.P.A.,
AK00337290,Mikroform␟Buch,"Follen, August Adolf Ludwig (1794-1855) [Verfasser/Urheber]",,Fliegendes Blatt von Einem Verschollenen. 2. verm. Ausg,"Follen, August Adolf Ludwig","Zürich, 1846",,Fliegendes Blatt von Einem Verschollenen. 2. verm. Ausg,,August Adolf Ludwig Follen,,Zürich,,1846,1846,,,,,,"Druckausg. anonym erschienen␟DM 63,- (Gesamtpreis für alle Werke des Autors in der Ed., 9 Mikrofiches, ISBN gültig für alle Werke des Autors)␟Mikrofiche-Ausg.␟München [u.a.] : Saur, 1994. Mikrofiche(s). (Bibliothek der deutschen Literatur ; Fiche 6645). Besitzer der Verfilmungsvorlage: 12. - Enth. in BDL-Teilausg.: Restauration, Hessen. ISBN 3-598-50764-X ISBN 3-598-50020-3 ISBN 3-598-50050-5",3-598-50764-X␟3-598-50020-3␟3-598-50050-5,,,,,,MPF BDL 6645,
AK01026905,Mehrteiliges Werk,"Follenius, Emanuel Friedrich Wilhelm Ernst (1773-1809) [Verfasser/Urheber]","Schiller, Friedrich von (1759-1805) [Verfasser der literarischen Vorlage]",Friedrich von Schiller's Geisterseher : aus den Papieren des Grafen von O** - 5. Aufl.,"Follenius, Emanuel Friedrich Wilhelm Ernst; Schiller, Friedrich von",Leipzig : Barth,Barth,Friedrich von Schiller's Geisterseher,aus den Papieren des Grafen von O**,von X** Y*** Z* [i.e. Emanuel Friedrich Wilhelm Ernst Follenius],5. Aufl.,Leipzig,Barth,,,,,,,,"Verf. ermittelt in: Holzmann, Michael: Deutsches Anonymen-Lexikon / aus den Quellen bearb. von Michael Holzmann und Hanns Bohatta. - Weimar. Bd. 2 (1903), Titelnr. 5713",,Erzählende Prosa,,Deutsch,,,,H
AK01557681,Buch,"Fontane, Theodor (1819-1898) [Verfasser/Urheber]","Bruyn, Günter de (1926-2020) [Herausgeber]",¬Die¬ schönsten Wanderungen durch die Mark Brandenburg,"Fontane, Theodor; Bruyn, Günter de","Frankfurt am Main : FISCHER Taschenbuch, September 2017 - 375 Seiten",Fischer-Taschenbuch-Verl.,Die schönsten Wanderungen durch die Mark Brandenburg,,Theodor Fontane ; ausgewählt und mit einem Nachwort von Günter de Bruyn,,Frankfurt am Main,FISCHER Taschenbuch,September 2017,2017,,375 Seiten,Faksimile,Fischer ; 90661 : Fischer Klassik,90661,Auszug aus: Wanderungen durch die Mark Brandenburg,978-3-596-90661-1,Erzählende Prosa,,Deutsch,,,I,
AK01237165,Buch,"Fontane, Theodor (1819-1898) [Verfasser/Urheber]","Balk, Ernst Wilhelm [Herausgeber]␟Ulrich, Gerhard (1903-1988) [Illustrator]",Ewig junger alter Fontane : eine Auswahl aus Theodor Fontanes Werken : [Werke Sammlung],"Fontane, Theodor; Balk, Ernst Wilhelm; Ulrich, Gerhard","Berlin : Büchergilde Gutenberg, 1944 - 333 Seiten",Büchergilde Gutenberg,Ewig junger alter Fontane,eine Auswahl aus Theodor Fontanes Werken,hrsg. und eingel. von Ernst Wilhelm Balk. Mit Zeichn. von Gerhard Ulrich,,Berlin,Büchergilde Gutenberg,1944,1944,,333 Seiten,Ill.,,,In Fraktur.,,Lyrik␟Erzählende Prosa␟Sonstige Texte,Werke Sammlung,Deutsch,,,I,
AK01001015,Buch,"Fontane, Theodor (1819-1898) [Verfasser/Urheber]",,Gedichte - 4. verm. Aufl.,"Fontane, Theodor","Berlin : Hertz, 1892 - XII, 447 Seiten",Hertz,Gedichte,,von Theodor Fontane,4. verm. Aufl.,Berlin,Hertz,1892,1892,,"XII, 447 Seiten",Ill.,,,,,,,Deutsch,,,I,
AK01644734,Buch,"Fontane, Theodor (1819-1898) [Verfasser/Urheber]","Böttcher, Philipp (1986-) [Verfasser eines Nachworts]␟Betz, Frederick [Verfasser]␟Böttcher, Philipp (1986-) [Verfasser]","Irrungen, Wirrungen : Roman","Fontane, Theodor; Böttcher, Philipp; Betz, Frederick; Böttcher, Philipp","Ditzingen : Reclam, 2019 - 211 Seiten",Reclam,"Irrungen, Wirrungen",Roman,Theodor Fontane ; Anmerkungen von Frederick Betz und Philipp Böttcher ; Nachwort von Philipp Böttcher,,Ditzingen,Reclam,2019,2019,,211 Seiten,,,19601,,978-3-15-019601-4,Erzählende Prosa,,Deutsch,,,I,
AK00197288,Buch,"Fontane, Theodor (1819-1898) [Verfasser/Urheber]","Brahm, Otto (1856-1912) [Verfasser eines Nachworts]","Irrungen, Wirrungen : Roman","Fontane, Theodor; Brahm, Otto","Zürich : Diogenes, 1998 - 217 Seiten",Diogenes,"Irrungen, Wirrungen",Roman,Theodor Fontane. Mit einem Nachw. von Otto Brahm,,Zürich,Diogenes,1998,1998,,217 Seiten,,Diogenes-Taschenbuch ; 23081 : detebe-Klassiker,23081,"kart. : DM 16.90, S 123.00, sfr 16.90",3-257-23081-8,,,Deutsch,,,W,
AK01001036,Buch,"Fontane, Theodor (1819-1898) [Verfasser/Urheber]",,Jenseits des Tweed : Bilder und Briefe aus Schottland - 1. Aufl.,"Fontane, Theodor","Frankfurt am Main : Insel-Verl., 1989 - 328 Seiten",Insel-Verl. <ab 1946>,Jenseits des Tweed,Bilder und Briefe aus Schottland,Theodor Fontane. Mit zahlr. Abb. u.e. Nachw. von Otto Drude,1. Aufl.,Frankfurt am Main,Insel-Verl.,1989,1989,,328 Seiten,Ill.,Insel-Taschenbuch ; 1066,1066,kart. : DM 18.00␟Mit gedr. Widmung an Bernhard von Lepel,3-458-32766-5,,,Deutsch,,,W,
AK01200033,Buch␟Buchumschlag,"Fontane, Theodor (1819-1898) [Verfasser/Urheber]","Goldammer, Peter (1921-2014) [Verfasser eines Nachworts]␟Lenz, Ingeborg [Illustrator]",L'Adultera : die Ehebrecherin ; Novelle - 4. Aufl.,"Fontane, Theodor; Goldammer, Peter; Lenz, Ingeborg","Rudolstadt : Greifenverl., 1988 - 191 Seiten",Greifen-Verl.,L'Adultera,die Ehebrecherin ; Novelle,Theodor Fontane. [Nachw. von Peter Goldammer. Ill. von Ingeborg Lenz],4. Aufl.,Rudolstadt,Greifenverl.,1988,1988,,191 Seiten,Ill.,,,,3-7352-0139-3,Erzählende Prosa,,Deutsch,,,I,
AK01001409,Buch,"Fontane, Theodor (1819-1898) [Verfasser/Urheber]","Neuendorff-Fürstenau, Jutta [Herausgeber]",Meine Kinderjahre : autobiographischer Roman - Ungekürzte Ausg.,"Fontane, Theodor; Neuendorff-Fürstenau, Jutta","München : Dt. Taschenbuch-Verl., 1971 - 229 Seiten",Dt. Taschenbuch-Verl.,Meine Kinderjahre,autobiographischer Roman,Theodor Fontane. Unter Mitw. von Kurt Schreinert hrsg. von Jutta Neuendorff-Fürstenau. Mit einer Zeittaf. von Hans Heinrich Reuter,Ungekürzte Ausg.,München,Dt. Taschenbuch-Verl.,1971,1971,,229 Seiten,,dtv ; 6004 : text-bibliothek,6004,"Lizenz d. Nymphenburger Verlagshandl., München␟kart. : DM 4.80",3-423-06004-2,,,Deutsch,,,I,
AK00393337,Buch,"Fontane, Theodor (1819-1898) [Verfasser/Urheber]","Keitel, Walter [Herausgeber]␟Nürnberger, Helmuth (1930-2017) [Herausgeber]","Sämtliche Werke. - Abt. 1, Sämtliche Romane, Erzählungen, Gedichte, Nachgelassenes ; 2. ¬[L'¬ Adultera. Cécile. Irrungen Wirrungen. Stine. Unwiederbringlich] - 2. Aufl., nach den Erstausg. und Vorabdr. rev. und im Anh. erw.","Fontane, Theodor; Keitel, Walter; Nürnberger, Helmuth","München : Hanser, 1971 - 1047 Seiten",,[L' Adultera. Cécile. Irrungen Wirrungen. Stine. Unwiederbringlich],,,"2. Aufl., nach den Erstausg. und Vorabdr. rev. und im Anh. erw.",,,1971,1971,,1047 Seiten,,,"Abt. 1, Sämtliche Romane, Erzählungen, Gedichte, Nachgelassenes ; 2",,3-446-11429-7␟3-446-11430-0,Erzählende Prosa,,Deutsch,,,I,
AK00131454,Buch,"Fontane, Theodor (1819-1898) [Verfasser/Urheber]","Keitel, Walter [Herausgeber]␟Nürnberger, Helmuth (1930-2017) [Herausgeber]","Sämtliche Werke. - Abt. 1, Sämtliche Romane, Erzählungen, Gedichte, Nachgelassenes ; 5. ¬[Der¬ Stechlin] - 3., durchges. und im Anh. erw. Aufl.","Fontane, Theodor; Keitel, Walter; Nürnberger, Helmuth","München : Hanser, 1994 - 538 Seiten",,[Der Stechlin],,,"3., durchges. und im Anh. erw. Aufl.",,,1994,1994,,538 Seiten,,,"Abt. 1, Sämtliche Romane, Erzählungen, Gedichte, Nachgelassenes ; 5",,3-446-11454-8,,,Deutsch,,,,
AK00197286,Buch,"Fontane, Theodor (1819-1898) [Verfasser/Urheber]","Mann, Thomas (1875-1955) [Verfasser eines Nachworts]␟Mann, Thomas (1875-1955) [Herausgeber]",Stine : Roman,"Fontane, Theodor; Mann, Thomas; Mann, Thomas","Zürich : Diogenes, 1998 - 152 Seiten",Diogenes,Stine,Roman,Theodor Fontane. Mit einem Nachw. von Thomas Mann,,Zürich,Diogenes,1998,1998,,152 Seiten,,Diogenes-Taschenbuch ; 23085 : detebe-Klassiker,23085,"kart. : DM 14.90, S 109.00, sfr 14.90",3-257-23085-0,,,Deutsch,,,W,
AK01240630,Buch␟Buchumschlag,"Fontane, Theodor (1819-1898) [Verfasser/Urheber]","Jolles, Charlotte (1909-2003) [Herausgeber]␟Erler, Gotthard (1933-) [Herausgeber]␟Erler, Gotthard (1933-) [Herausgeber]",Tage- und Reisetagebücher. - 3. ¬Die¬ Reisetagebücher - 1. Aufl.,"Fontane, Theodor; Jolles, Charlotte; Erler, Gotthard; Erler, Gotthard","Berlin : Aufbau-Verl., 2012 - XXXIV, 922 Seiten",,Die Reisetagebücher,,hrsg. von Gotthard Erler ...,1. Aufl.,,,2012,2012,,"XXXIV, 922 Seiten",Ill.,,3,,978-3-351-03101-5,,,Deutsch,,,I,
AK01000531,Buch␟Buchumschlag,"Fontane, Theodor (1819-1898) [Verfasser/Urheber]","Nast, Bernhard (1924-2001) [Illustrator]","Um Stunden, höchstens Tage : Gedichte und eine Erzählung - 1. Aufl. : [Werke Sammlung]","Fontane, Theodor; Nast, Bernhard","Berlin : Kinderbuchverl., 1987 - 157 Seiten",Kinderbuchverl.,"Um Stunden, höchstens Tage",Gedichte und eine Erzählung,Theodor Fontane. [Ill. von Bernhard Nast],1. Aufl.,Berlin,Kinderbuchverl.,1987,1987,,157 Seiten,Ill.,Kleine Bibliothek,,Gewebe : M 6.20,3-358-00071-0,,Werke Sammlung,Deutsch,,,I,
AK01001356,Buch,"Fontane, Theodor (1819-1898) [Verfasser/Urheber]",,Unterm Birnbaum,"Fontane, Theodor","Berlin : Grote, 1885 - 156 Seiten",Grote,Unterm Birnbaum,,Theodor Fontane,,Berlin,Grote,1885,1885,,156 Seiten,,Grote'sche Sammlung von Werken zeitgenössischer Schriftsteller ; 23,23,Roman,,,,Deutsch,,,I␟Glück:I␟Glück:I,
AK00969885,Buch,"Fontane, Theodor (1819-1898) [Verfasser/Urheber]","Nürnberger, Helmuth (1930-2017) [Herausgeber]","Unwiederbringlich : Roman - Vollst., im Kommentar rev. und mit einem Nachw. vers. Ausg.","Fontane, Theodor; Nürnberger, Helmuth","München : Dt. Taschenbuch-Verl., 1995 - 337 Seiten",Dt. Taschenbuch-Verl.,Unwiederbringlich,Roman,Theodor Fontane. Mit einem Nachw. neu hrsg. von Helmuth Nürnberger,"Vollst., im Kommentar rev. und mit einem Nachw. vers. Ausg.",München,Dt. Taschenbuch-Verl.,1995,1995,,337 Seiten,,"dtv ; 2349 : dtv Klassik : Literatur, Philosophie, Wissenschaft",2349,"Lizenz des Hanser-Verl., München",3-423-02349-X,Erzählende Prosa,,Deutsch,,,I,
AK00406088,Buch,"Forbes-Mosse, Irene (1864-1946) [Verfasser/Urheber]","Vogeler, Heinrich (1872-1942) [Illustrator]",Mezzavoce : Gedichte,"Forbes-Mosse, Irene; Vogeler, Heinrich","Berlin : Schuster & Loeffler, 1901 - 144 Seiten : Ill.",Schuster & Loeffler,Mezzavoce,Gedichte,von Irene Forbes-Mosse. Mit Buchschmuck von Heinrich Vogeler,,Berlin,Schuster & Loeffler,1901,1901,,144 Seiten : Ill.,,,,Mit gedr. Widmung an Elisabeth von Heyking,,,,,,,K␟Glück:K,
AK01643024,Buch,"Förg, Nicola (1962-) [Verfasser/Urheber]",,Wütende Wölfe : ein Alpen-Krimi,"Förg, Nicola","München ; Berlin : Pendo, 2019 - 351 Seiten",Pendo-Verl.,Wütende Wölfe,ein Alpen-Krimi,Nicola Förg,,München ; Berlin,Pendo,2019,2019,,351 Seiten,,,,,978-3-86612-420-2,Erzählende Prosa,,Deutsch,,,N,
AK01186028,Buch␟Buchumschlag,"Forgó, Léda (1973-) [Verfasser/Urheber]",,Vom Ausbleiben der Schönheit : Roman - 1. Aufl.,"Forgó, Léda","Berlin : Rowohlt Berlin, 2010 - 252 Seiten",Rowohlt Berlin,Vom Ausbleiben der Schönheit,Roman,Léda Forgó,1. Aufl.,Berlin,Rowohlt Berlin,2010,2010,,252 Seiten,,,,,978-3-87134-676-7,Erzählende Prosa,,Deutsch,,,N,
AK01212568,Buch,"Förster, Ernst (1800-1885) [Verfasser/Urheber]",,"Handbuch für Reisende in Deutschland : mit 15 Eisenbahnkarten, 13 Städteplänen und 1 Karte von Deutschland - Zweite vermehrte Auflage","Förster, Ernst","München : Literarisch-Artistische Anstalt der J.G. Cotta'schen Buchhandlung, 1853 - 685 Seiten",Verl. der Literarisch-artistischen Anst.,Handbuch für Reisende in Deutschland,"mit 15 Eisenbahnkarten, 13 Städteplänen und 1 Karte von Deutschland",von Dr. Ernst Förster,Zweite vermehrte Auflage,München,Literarisch-Artistische Anstalt der J.G. Cotta'schen Buchhandlung,1853,1853,,685 Seiten,Karten,,,In Fraktur,,,,Deutsch,,Rückentitel: Förster's Reisehandbuch für Deutschland␟Einbandtitel: Förster's Deutschland,Cotta Hss Slg,
