Auszug Katalog DLA Marbach 08 2023,,,,,,,,,,,,,,,,,,,,,,,,,,,,,
,,,,,,,,,,,,,,,,,,,,,,,,,,,,,
id_Katalog,Medium,Person_Verfasser,Person_beteiligt,Titel,"Verfasser, beteiligte",Impressum,Verlag normiert,Haupttitel,Titelzusatz,Verfasserangabe,Auflage,Erscheiungsort,Verlag,Jahr,Jahr_normiert,Bandangabe_Mehrb. Weri,Seiten,Ill-Vermerk,Reihe,Reihe_Nummer,Anmerkung,ISBN,Gattung,Art_Inhalt,Sprache,Sprache_Original,Weitere Titel,Signatur,Signatur_Mehrb_Werk
AK00821000,Buch,"Ach, Manfred (1946-) [Verfasser/Urheber]","Bosch, Manfred (1947-) [Verfasser]␟Ziffer, J. J. [Illustrator]",¬Der¬ neue Büchmann : aus dem Wortschwatz einer Klassikergesellschaft - 1. Auflage,"Ach, Manfred; Bosch, Manfred; Ziffer, J. J.","Hamburg : Edition Nautilus, Verlag Lutz Schulenburg, 1977 - 71 Seiten","Ed. Nautilus, Schulenburg",Der neue Büchmann,aus dem Wortschwatz einer Klassikergesellschaft,Dominikus Grosshirn ; Beigefügt: 7 Collagen von J.J. Ziffer,1. Auflage,Hamburg,"Edition Nautilus, Verlag Lutz Schulenburg",1977,1977,,71 Seiten,Illustrationen,Ed. Nautilus Flugschrift ; No. 18,No. 18,Dominikus Grosshirn ist das gemeinsame Pseudonym von Manfred Ach und Manfred Bosch,3-921523-17-6,Sonstige Texte,,Deutsch,,,M,
AK01261107,Buch,"Ach, Manfred (1946-) [Verfasser/Urheber]",,Rampensau : Bühnenreifes vom Mönch,"Ach, Manfred","München : ARW, 2005 - [14] Blatt",ARW,Rampensau,Bühnenreifes vom Mönch,[Manfred Ach],,München,ARW,2005,2005,,[14] Blatt,,Nada-Edition ; 38,38,,3-927890-83-9,Sonstige Texte,,Deutsch,,,M:Kps.,
AK01347675,Buch␟Buchumschlag,"Achleitner, Friedrich (1930-) [Verfasser/Urheber]","Achleitner, Friedrich (1930-) [Fotograf]",¬Den¬ Toten eine Blume : die Denkmäler von Bogdan Bogdanovic,"Achleitner, Friedrich; Achleitner, Friedrich","Wien : Zsolnay, 2013 - 183 Seiten",Zsolnay,Den Toten eine Blume,die Denkmäler von Bogdan Bogdanovic,Friedrich Achleitner. Fotos Friedrich Achleitner,,Wien,Zsolnay,2013,2013,,183 Seiten,zahlr. Ill.,,,,978-3-552-05647-3␟3-552-05647-5,Sonstige Texte␟Nichttextuelle Produktion,,Deutsch,,,M:Quart,
AK00086715,Buch,"Achleitner, Friedrich (1930-) [Verfasser/Urheber]",,Wiener Architektur : zwischen typologischem Fatalismus und semantischem Schlamassel,"Achleitner, Friedrich","Wien [u.a.] : Böhlau, 1996 - 231 Seiten",Böhlau <West>,Wiener Architektur,zwischen typologischem Fatalismus und semantischem Schlamassel,Friedrich Achleitner,,Wien [u.a.],Böhlau,1996,1996,,231 Seiten,Ill.,Kulturstudien : Sonderband ; 9,#NV␟9,,3-205-05388-5,,,Deutsch,,,,
AK00821139,Buch,"Achternbusch, Herbert (1938-2022) [Verfasser/Urheber]","Freyse, Gunter [Fotograf]",¬Die¬ Olympiasiegerin : Filmbuch - 1. Aufl.,"Achternbusch, Herbert; Freyse, Gunter","Frankfurt am Main : Suhrkamp, 1984 - 107 Seiten",Suhrkamp,Die Olympiasiegerin,Filmbuch,Herbert Achternbusch. [Fotos: Gunter Freyse],1. Aufl.,Frankfurt am Main,Suhrkamp,1984,1984,,107 Seiten,Ill.,Suhrkamp-Taschenbuch ; 1037,1037,,3-518-37531-8,,,Deutsch,,,M,
AK00821109,Buch,"Achternbusch, Herbert (1938-2022) [Verfasser/Urheber]",,¬Die¬ Stunde des Todes : Roman,"Achternbusch, Herbert","Frankfurt am Main : Suhrkamp, 1977 - 99 Seiten",Suhrkamp,Die Stunde des Todes,Roman,Herbert Achternbusch,,Frankfurt am Main,Suhrkamp,1977,1977,,99 Seiten,,Suhrkamp-Taschenbuch ; 449,449,,,,,Deutsch,,,M,
AK00821149,Buch,"Achternbusch, Herbert (1938-2022) [Verfasser/Urheber]",,Breitenbach,"Achternbusch, Herbert","Köln : Kiepenheuer & Witsch, 1986 - 130 Seiten",Kiepenheuer & Witsch,Breitenbach,,Herbert Achternbusch,,Köln,Kiepenheuer & Witsch,1986,1986,,130 Seiten,Ill.,,,,3-462-01751-9,,,Deutsch,,,M,
AK00995271,Buch,"Adelmann von Adelmannsfelden, Alfred (1848-1887) [Verfasser/Urheber]",,Am ligurischen Meere : die Naturpracht der Riviera di Ponente,"Adelmann von Adelmannsfelden, Alfred","Stuttgart : Richter & Kappler, 1883 - VIII, 263 Seiten",,Am ligurischen Meere,die Naturpracht der Riviera di Ponente,Alfred Graf Adelmann,,Stuttgart,Richter & Kappler,1883,1883,,"VIII, 263 Seiten",Ill.,,,,,,,Deutsch,,,I,
AK01638291,Buch,"Adelmann, Roland (1965-) [Verfasser/Urheber]",,Lady Gaga braucht ihre Coolness selbst um nicht aus dem Rennen geworfen zu werden,"Adelmann, Roland","[Dortmund] : Rodneys Underground Press, [2017] - 44 Seiten",Rodneys Underground Press,Lady Gaga braucht ihre Coolness selbst um nicht aus dem Rennen geworfen zu werden,,[Roland Adelmann],,[Dortmund],Rodneys Underground Press,[2017],2017,,44 Seiten,,,,,,Lyrik,,Deutsch,,,N:Kps.,
AK00995292,Buch,"Adelung, Sophie von (1850-1927) [Verfasser/Urheber]",,Er muß : Du-Scherz für 2 Damen,"Adelung, Sophie von","Stuttgart : Levy & Müller, [s.a.] - o.A.",Levy & Müller,Er muß,Du-Scherz für 2 Damen,Sophie von Adelung,,Stuttgart,Levy & Müller,[s.a.],,,o.A.,,,,,,,,,,,I,
AK00480038,Buch,"Adler, Hans (1880-1957) [Verfasser/Urheber]",,Affentheater : Gedichte,"Adler, Hans","Leipzig [u.a.] : Tal, 1920 - 80 Seiten",Tal,Affentheater,Gedichte,von Hans Adler,,Leipzig [u.a.],Tal,1920,1920,,80 Seiten,,,,#NV␟In Fraktur,,,,Deutsch,,,Glück:L,
AK01185459,Buch,"Adler, Hans Günther (1910-1988) [Verfasser/Urheber]","Adler, Jeremy (1947-) [Verfasser eines Vorworts]",¬Die¬ Dichtung der Prager Schule : [zum 100. Geburtstag von H. G. Adler am 2. Juli 2010] - 1. Aufl.,"Adler, Hans Günther; Adler, Jeremy","Wuppertal : Arco-Verl., 2010 - 39 Seiten",Arco-Verl.,Die Dichtung der Prager Schule,[zum 100. Geburtstag von H. G. Adler am 2. Juli 2010],H. G. Adler. Mit einem Vorw. Jeremy Adler,1. Aufl.,Wuppertal,Arco-Verl.,2010,2010,,39 Seiten,Ill.,Coll'arco ; 3,3,,978-3-938375-36-5,Sonstige Texte,,Deutsch,,,M:Kps.Quart,
AK01182539,Buch␟Buchumschlag,"Adler, Hans Günther (1910-1988) [Verfasser/Urheber]","Kohl, Katrin M. (1956-) [Herausgeber]␟Hocheneder, Franz (1962-) [Herausgeber]␟Adler, Jeremy (1947-) [Mitarbeiter]␟Krüger, Michael (1943-) [Verfasser eines Vorworts]",Andere Wege : gesammelte Gedichte : [Werke Sammlung],"Adler, Hans Günther; Kohl, Katrin M.; Hocheneder, Franz; Adler, Jeremy; Krüger, Michael","Klagenfurt ; Wien : Drava, 2010 - 1195 Seiten",Drava-Verl.,Andere Wege,gesammelte Gedichte,H. G. Adler. Hrsg. von Katrin Kohl ... unter Mitw. von Jeremy Adler. Mit einem Geleitw. von Michael Krüger,,Klagenfurt ; Wien,Drava,2010,2010,,1195 Seiten,,,25,,978-3-85435-625-7␟978-3-85435-624-0,Lyrik,Werke Sammlung,Deutsch,,,M,
AK00821181,Buch,"Adler, Hans Günther (1910-1988) [Verfasser/Urheber]",,Viele Jahreszeiten : Gedichte,"Adler, Hans Günther","Wien [u.a.] : Dürer, 1975 - 190 Seiten",Verl. Albrecht Dürer,Viele Jahreszeiten,Gedichte,H. G. Adler,,Wien [u.a.],Dürer,1975,1975,,190 Seiten,,,,,3-7008-0127-0,,,Deutsch,,,M,
AK01531758,Buch,"Adlersfeld-Ballestrem, Eufemia (1854-1941) [Verfasser/Urheber]",,¬Die¬ Fürstäbtissin. Der Spiegel der Lucrezia Borgia : zwei Erzählungen,"Adlersfeld-Ballestrem, Eufemia","Leipzig : Druck und Verlag von Philipp Reclam jun., [1906] - 109 Seiten",Reclam jun. <bis 1945>,Die Fürstäbtissin. Der Spiegel der Lucrezia Borgia,zwei Erzählungen,von Eufemia von Adlersfeld-Ballestrem,,Leipzig,Druck und Verlag von Philipp Reclam jun.,[1906],1906,,109 Seiten,,[Universal-Bibliothek ; 4837],[4837],In Fraktur,,Erzählende Prosa,,Deutsch,,,K,
AK00402742,Buch,"Adt, Wilhelm (1908-1952) [Verfasser/Urheber]",,¬Das¬ Verhältnis Stefan Georges und seines Kreises zu Hölderlin : [Hochschulschrift],"Adt, Wilhelm","Frankfurt am Main, 1934 - 89 Seiten",,Das Verhältnis Stefan Georges und seines Kreises zu Hölderlin,,Wilhelm Adt,,Frankfurt am Main,,1934,1934,,89 Seiten,,,,"Frankfurt a.M., Univ., Diss., 1934",,,Hochschulschrift,Deutsch,,,KK:Kps.,
AK00480065,Buch,"Ahemm, Hildegard (1908-) [Verfasser/Urheber]",,Tates Wahltochter : Erzählung,"Ahemm, Hildegard","Rothenburg o.d. Tauber : Peter, 1976 - 155 Seiten",,Tates Wahltochter,Erzählung,Hildegard Ahemm,,Rothenburg o.d. Tauber,Peter,1976,1976,,155 Seiten,,,,,,,,,,,L,
AK00203591,Mikroform␟Buch,"Ahlefeld, Charlotte von (1777-1849) [Verfasser/Urheber]",,Bunte Blätter zur flüchtigen Unterhaltung aus dem Reiche der Wirklichkeit und der Phantasie - [Mikrofiche-Ausg.],"Ahlefeld, Charlotte von","Quedlinburg [u.a.] : Basse, 1826 - 247 Seiten",Basse,Bunte Blätter zur flüchtigen Unterhaltung aus dem Reiche der Wirklichkeit und der Phantasie,,von d. Verf. d. 'Clara' ...,[Mikrofiche-Ausg.],Quedlinburg [u.a.],Basse,1826,1826,,247 Seiten,,,,"Mikrofiche-Ausg.: Wildberg : Belser Wiss. Dienst, 1989 - 1990. (Edition Corvey)",3-628-40837-7,,,Deutsch,,,MPF Corvey <3-628-40837-7>,
AK00821302,Buch␟Buchumschlag,"Ahlsen, Leopold (1927-2018) [Verfasser/Urheber]",,¬Die¬ Wiesingers in stürmischer Zeit : Roman e. Familie,"Ahlsen, Leopold","Bergisch Gladbach : Lübbe, 1987 - 416 Seiten",Lübbe,Die Wiesingers in stürmischer Zeit,Roman e. Familie,Leopold Ahlsen,,Bergisch Gladbach,Lübbe,1987,1987,,416 Seiten,,,,Pp. (Pr. nicht mitget.),3-7857-0462-3,,,,,,M,
AK00113666,Buch␟Buchumschlag,"Aichinger, Ilse (1921-2016) [Verfasser/Urheber]","Fässler, Simone [Herausgeber]",Kurzschlüsse : Wien - Orig.-Ausg.,"Aichinger, Ilse; Fässler, Simone","Wien : Ed. Korrespondenzen, 2001 - 83 Seiten",Edition Korrespondenzen,Kurzschlüsse,Wien,Ilse Aichinger. Hrsg. und mit e. Nachw. von Simone Fäßler,Orig.-Ausg.,Wien,Ed. Korrespondenzen,2001,2001,,83 Seiten,,,,,3-902113-07-3,Erzählende Prosa,,Deutsch,,,M,
AK01731172,Buch,"Aichinger, Ilse (1921-2016) [Verfasser/Urheber]","Altenrath, Renate [Illustrator]",Seegeister - Einmalige Auflage : [Pressendruck],"Aichinger, Ilse; Altenrath, Renate","Braunschweig : Hochschule für Bildende Künste, 1970 - [18] Seiten",Hochschule für Bildende Künste,Seegeister,,"Ilse Aichinger ; Entwurf, Graphik und Druck von Renate Altenrath",Einmalige Auflage,Braunschweig,Hochschule für Bildende Künste,1970,1970,,[18] Seiten,Illustrationen,,,,,Erzählende Prosa,Pressendruck,Deutsch,,,M:Quart,
AK00345504,Buch,"Aichinger, Ilse (1921-2016) [Verfasser/Urheber]␟","Reichensperger, Richard (1961-2004) [Herausgeber]␟␟Aichinger, Ilse (1921-2016) [Verfasser]",Werke : Taschenbuchausgabe in acht Bänden - ¬Die¬ größere Hoffnung : Roman,"Aichinger, Ilse; Reichensperger, Richard; Aichinger, Ilse","Frankfurt am Main : Fischer-Taschenbuch-Verl., Frankfurt am Main : Fischer, 1991 - 286 S",S. Fischer,Die größere Hoffnung,Roman,Ilse Aichinger [Verfasser],,Frankfurt am Main,Fischer,1991,1991,,286 S,,#NV␟Fischer-Taschenbücher ; 11041,#NV␟11041,,3-596-11041-6,,,,,,M,
AK00334287,Mikroform␟Buch,"Aichinger, Karl Friedrich (1717-1782) [Verfasser/Urheber]",,"Bemühung der Obern Pfalz, den Zorn ... Gottscheds zu besänfftigen","Aichinger, Karl Friedrich","[S.l.], 1750",,"Bemühung der Obern Pfalz, den Zorn ... Gottscheds zu besänfftigen",,Karl Friedrich Aichinger,,[S.l.],,1750,1750,,,,,,"Druckausg. anonym erschienen␟DM 20,- (Gesamtpreis für alle Werke des Autors in der Ed., 1 Mikrofiche, ISBN gültig für alle Werke des Autors)␟Mikrofiche-Ausg.␟München [u.a.] : Saur, 1994. Mikrofiche(s). (Bibliothek der deutschen Literatur ; Fiche 6). Besitzer der Verfilmungsvorlage: 12. - Enth. in BDL-Teilausg.: Aufklärung, Oberbayern/Niederbayern/Oberpfalz. ISBN 3-598-50022-X ISBN 3-598-50015-7 ISBN 3-598-50065-3",3-598-50022-X␟3-598-50015-7␟3-598-50065-3,,,,,,MPF BDL 6,
AK01584989,Buch,"Akkordéon, Pètrus (1971-) [Verfasser/Urheber]","Akkordéon, Pètrus (1971-) [Illustrator]",Gedichte und Linolschnitte - Einmalige Auflage,"Akkordéon, Pètrus; Akkordéon, Pètrus","Berlin : Andante Handpresse, 2017 - [24] Seiten",Andante Handpresse,Gedichte und Linolschnitte,,Petrus Akkordeon,Einmalige Auflage,Berlin,Andante Handpresse,2017,2017,,[24] Seiten,Illustrationen,,15,,,Lyrik,,Deutsch,,,N:Kps.,
AK00140112,Buch,"Aktoprak, Levent (1959-) [Verfasser/Urheber]","Rademacher, Gerhard (1935-) [Verfasser eines Vorworts]",Unterm Arm die Odyssee : Gedichte - 1. Aufl.,"Aktoprak, Levent; Rademacher, Gerhard","Frankfurt (Main) : Da€gyeli, 1987 - 61 Seiten",Dagyeli,Unterm Arm die Odyssee,Gedichte,Levent Aktoprak. Mit einem Vorw. von Gerhard Rademacher,1. Aufl.,Frankfurt (Main),Da€gyeli,1987,1987,,61 Seiten,,,,,3-924320-56-X,Lyrik,,Deutsch,,,CPS/AKT1,
AK00140236,Buch,"Alafenisch, Salim (1948-) [Verfasser/Urheber]",,¬Das¬ Kamel mit dem Nasenring,"Alafenisch, Salim","Zürich : Unionsverl., 1990 - 179 Seiten",Unionsverl.,Das Kamel mit dem Nasenring,,Salim Alafenisch,,Zürich,Unionsverl.,1990,1990,,179 Seiten,,,,,3-293-00162-9,Erzählende Prosa,,Deutsch,,,CPS/ALA3,
AK01601625,Buch,"Albers, Sabrina [Verfasser/Urheber]","Butcher, Kaethe [Illustrator]",¬Der¬ Nebel in mir : Stories & Poems - 2. Auflage,"Albers, Sabrina; Butcher, Kaethe","Speyer : Sabrina Albers, 2016 - 76 Seiten",Sabrina Albers,Der Nebel in mir,Stories & Poems,Sabrina Albers ; [Illustrationen: Kaethe Butcher],2. Auflage,Speyer,Sabrina Albers,2016,2016,,76 Seiten,Illustrationen,,,,978-3-7418-3060-0,Erzählende Prosa,,Deutsch,,,N:Kps.,
AK00397346,Buch,"Alberti, Conrad (1862-1918) [Verfasser/Urheber]",,Riesen und Zwerge : Roman - 2. Aufl.,"Alberti, Conrad","Leipzig : Friedrich, [1889] - 270 Seiten",Friedrich,Riesen und Zwerge,Roman,von Conrad Alberti,2. Aufl.,Leipzig,Friedrich,[1889],1889,,270 Seiten,,,,,,,,Deutsch,,,K,
AK00122159,Buch,"Alberts, Jürgen (1946-) [Verfasser/Urheber]",,Landru : Roman,"Alberts, Jürgen","Göttingen : Steidl, 1998 - 256 Seiten",Steidl,Landru,Roman,Jürgen Alberts,,Göttingen,Steidl,1998,1998,,256 Seiten,,stb ; 124,124,,3-88243-599-2,Erzählende Prosa,,Deutsch,,,M,
AK01778752,Buch,"Alberts, Jürgen (1946-) [Verfasser/Urheber]","Alberts, Marita (1946-) [Mitwirkender]","Zufall, Chuzpe und ein Quäntchen Glück : mein Leben in Anekdoten - 1. Auflage : [Erinnerung, Autobiographisches, Memoiren]","Alberts, Jürgen; Alberts, Marita","Bremen : Edition Falkenberg, 2021 - 181 Seiten",Edition Falkenberg,"Zufall, Chuzpe und ein Quäntchen Glück",mein Leben in Anekdoten,Alberts Jürgen,1. Auflage,Bremen,Edition Falkenberg,2021,2021,,181 Seiten,,,,,9783954942497␟3954942496,,"Erinnerung, Autobiographisches, Memoiren",Deutsch,,,M,
AK00334322,Mikroform␟Buch,"Albrecht, Johann Friedrich Ernst (1752-1814) [Verfasser/Urheber]",,¬Der¬ Laufpass fürs achtzehnte Jahrhundert,"Albrecht, Johann Friedrich Ernst","Hamburg, 1801",,Der Laufpass fürs achtzehnte Jahrhundert,,Johann Friedrich Ernst Albrecht,,Hamburg,,1801,1801,,,,,,"Druckausg. anonym erschienen␟DM 336,- (Gesamtpreis für alle Werke des Autors in der Ed., 49 Mikrofiches, ISBN gültig für alle Werke des Autors)␟Mikrofiche-Ausg.␟München [u.a.] : Saur, 1994. Mikrofiche(s). (Bibliothek der deutschen Literatur ; Fiche 5626/5627). Besitzer der Verfilmungsvorlage: 12. - Enth. in BDL-Teilausg.: Klassik/Romantik, Niedersachsen. ISBN 3-598-50026-2 ISBN 3-598-50017-3 ISBN 3-598-50040-8",3-598-50026-2␟3-598-50017-3␟3-598-50040-8,,,,,,MPF BDL 5626/5627,
AK00076566,Buch,"Alexander, Elisabeth (1922-2009) [Verfasser/Urheber]",,Domizil Heidelberg : Erzählungen - 2. Aufl.,"Alexander, Elisabeth","Speyer : Lösch, 1995 - 61 Seiten",Lösch,Domizil Heidelberg,Erzählungen,Elisabeth Alexander,2. Aufl.,Speyer,Lösch,1995,1995,,61 Seiten,,Kleine literarische Reihe ; 3,3,,3-930122-06-5,Erzählende Prosa,,Deutsch,,,M,
AK01733495,Buch,"Alexis, Willibald (1798-1871) [Verfasser/Urheber]",,Cabanis : Roman in sechs Büchern. - 3. Buch. ¬Der¬ Marquis,"Alexis, Willibald","Berlin : Fincke, 1832 - 6 Bände, 1832 - 257 Seiten",,Der Marquis,,,,,,1832,1832,,257 Seiten,,,3. Buch,,,,,Deutsch,,,I,
AK00089987,Mehrteiliges Werk,"Alexis, Willibald (1798-1871) [Verfasser/Urheber]","Miller, Norbert (1937-) [Herausgeber]␟Bernauer, Markus (1958-) [Herausgeber]",Romane und Erzählungen : Gesamtausgabe : [Werkausgabe],"Alexis, Willibald; Miller, Norbert; Bernauer, Markus",Hildesheim ; Zürich ; New York : Olms,Olms,Romane und Erzählungen,Gesamtausgabe,Willibald Alexis. Hrsg. von Norbert Miller ...,,Hildesheim ; Zürich ; New York,Olms,,,,,,Deutsche Literatur im 19. Jahrhundert,,In Fraktur,3-487-10102-5,,Werkausgabe,Deutsch,,,,Hb.4/6:Ale / I (Werke:1996)
AK00203654,Mikroform␟Buch,"Alexis, Willibald (1798-1871) [Verfasser/Urheber]",,Ruhe ist die erste Bürgerpflicht : oder Vor 50 Jahren ; vaterländ. Roman. - 3 (1852).,"Alexis, Willibald","Berlin : Barthol, 1852 - 315 Seiten",,,,,,,,1852,1852,,315 Seiten,,,3 (1852),,3-628-39504-6,,,Deutsch,,,MPF Corvey <3-628-39504-6>,
AK00339178,Mikroform␟Buch,"Alexis, Willibald (1798-1871) [Verfasser/Urheber]",,Shakspeare und seine Freunde ...,"Alexis, Willibald","Berlin, 1839 - 3 Bd.",,Shakspeare und seine Freunde ...,,Willibald Alexis,,Berlin,,1839,1839,,3 Bd.,,,,"Druckausg. unter Pseudonym erschienen␟DM 742,- (Gesamtpreis für alle Werke des Autors in der Ed., 109 Mikrofiches, ISBN gültig für alle Werke des Autors)␟Mikrofiche-Ausg.␟München [u.a.] : Saur, 1994. Mikrofiche(s). (Bibliothek der deutschen Literatur ; Fiche 7304/7305). Besitzer der Verfilmungsvorlage: 19. - Enth. in BDL-Teilausg.: Restauration, Schlesien, Reiseliteratur. ISBN 3-598-51043-8 ISBN 3-598-50020-3 ISBN 3-598-50035-1 ISBN 3-598-50115-3",3-598-51043-8␟3-598-50020-3␟3-598-50035-1␟3-598-50115-3,,,,,,MPF BDL 7304/7305,
AK00061460,Buch,"Allert-Wybranietz, Kristiane (1955-) [Verfasser/Urheber]",,Leben ist Liebe : die schönsten Verschenk-Texte - 4. Aufl.,"Allert-Wybranietz, Kristiane","München : Heyne, 1998 - 115 Seiten",Heyne,Leben ist Liebe,die schönsten Verschenk-Texte,von Kristiane Allert-Wybranietz,4. Aufl.,München,Heyne,1998,1998,,115 Seiten,,"Heyne-Bücher : 01, Heyne allgemeine Reihe ; Nr. 9705",#NV␟Nr. 9705,,3-453-09227-9,Lyrik,,Deutsch,,,M,
AK00181199,Buch,"Altendorf, Wolfgang (1921-2007) [Verfasser/Urheber]","Altendorf, Irmeli [Herausgeber]",¬Der¬ arme Mensch : Drama (in griechischer Sprache) - Bibliophile Sonderausg. : [Übersetzung deutschspr. Literatur],"Altendorf, Wolfgang; Altendorf, Irmeli","Freudenstadt : Altendorf, [ca. 2003] - [22] Seiten",Altendorf,Der arme Mensch,Drama (in griechischer Sprache),Wolfgang Altendorf. Hrsg. v. Irmeli Altendorf,Bibliophile Sonderausg.,Freudenstadt,Altendorf,[ca. 2003],2003,,[22] Seiten,,,,,,Dramatisches,Übersetzung deutschspr. Literatur,Griechisch,,Der arme Mensch <griech.>,M,
AK00063594,Buch,"Altendorf, Wolfgang (1921-2007) [Verfasser/Urheber]","Altendorf, Irmeli [Herausgeber]","1999 : dies Jahrhundert, darf ich's preisen? ; Dichtung - bibliophile Sonderausg.","Altendorf, Wolfgang; Altendorf, Irmeli","Freudenstadt : Altendorf, [ca. 1999] - [13] Blatt",Altendorf,1999,"dies Jahrhundert, darf ich's preisen? ; Dichtung",Wolfgang Altendorf. Hrsg. von Irmeli Altendorf,bibliophile Sonderausg.,Freudenstadt,Altendorf,[ca. 1999],1999,,[13] Blatt,,,,,,Lyrik,,Deutsch,,,M:Kps.,
AK01232829,Buch,"Altendorf, Wolfgang (1921-2007) [Verfasser/Urheber]","Altendorf, Irmeli [Herausgeber]␟Altendorf, Wolfgang (1921-2007) [Illustrator]","Deidesheim Impressionen : Bilder und Texte über eine liebenswerte Stadt in der Pfalz, ihre Menschen, ihre Kultur und ihren Wein ; aus : Deidesheim gewidmeten zahlreichen Veröffentlichungen während seiner Zeit als Erster Turmschreiber und die Jahre danach - 1. Aufl. : [Erinnerung, Autobiographisches, Memoiren]","Altendorf, Wolfgang; Altendorf, Irmeli; Altendorf, Wolfgang","Freudenstadt-Wittlensweiler : Altendorf, [o.J.] - [21] Blatt",Altendorf,Deidesheim Impressionen,"Bilder und Texte über eine liebenswerte Stadt in der Pfalz, ihre Menschen, ihre Kultur und ihren Wein ; aus : Deidesheim gewidmeten zahlreichen Veröffentlichungen während seiner Zeit als Erster Turmschreiber und die Jahre danach",Wolfgang Altendorf. [Hrsg. ... Irmeli Altendorf],1. Aufl.,Freudenstadt-Wittlensweiler,Altendorf,[o.J.],,,[21] Blatt,,,,Kunstmappe mit handsignierten Zeichnungen von Wolfgang Altendorf - Aufl.: 50 Ex.,,Nichttextuelle Produktion,"Erinnerung, Autobiographisches, Memoiren",Deutsch,,,M:Kps.Quart,
AK01326218,Buch,"Altendorf, Wolfgang (1921-2007) [Verfasser/Urheber]","Altendorf, Irmeli [Herausgeber]␟Altendorf, Wolfgang (1921-2007) [Illustrator]",Drei Musen : Gedichte und Zeichn. - Bibliophile Sonderausg.,"Altendorf, Wolfgang; Altendorf, Irmeli; Altendorf, Wolfgang","Freudenstadt : Altendorf, [1990] - 23 Seiten",Altendorf,Drei Musen,Gedichte und Zeichn.,Wolfgang Altendorf. Hrsg. und Nachwort Irmeli Altendorf,Bibliophile Sonderausg.,Freudenstadt,Altendorf,[1990],1990,,23 Seiten,Ill.,,,Doppelblattpfalz,,Lyrik␟Nichttextuelle Produktion,,Deutsch,,,M,
AK01231599,Buch,"Altendorf, Wolfgang (1921-2007) [Verfasser/Urheber]","Altendorf, Irmeli [Herausgeber]",Eva und Adam : zwei paradiesische Balladen,"Altendorf, Wolfgang; Altendorf, Irmeli","Freudenstadt : Altendorf, [s.a.] - 33 Seiten",Altendorf,Eva und Adam,zwei paradiesische Balladen,Wolfgang Altendorf. Hrsg. von Irmeli Altendorf,,Freudenstadt,Altendorf,[s.a.],,,33 Seiten,Ill.,,,,,Lyrik,,Deutsch,,,M,
AK00181344,Buch,"Altendorf, Wolfgang (1921-2007) [Verfasser/Urheber]","Altendorf, Irmeli [Herausgeber]","Faszination des Sports : Zehn Zeichnungen und fünf Texte zum Thema in seinem von ihm kreierten linear-dynamischen Stil, die Zeichnungen von ihm jeweils handsigniert","Altendorf, Wolfgang; Altendorf, Irmeli","Freudenstadt : Altendorf, [ca. 2003] - [18] Blatt",Altendorf,Faszination des Sports,"Zehn Zeichnungen und fünf Texte zum Thema in seinem von ihm kreierten linear-dynamischen Stil, die Zeichnungen von ihm jeweils handsigniert",Wolfgang Altendorf. Hrsg. von Irmeli Altendorf,,Freudenstadt,Altendorf,[ca. 2003],2003,,[18] Blatt,überw. Ill.,,,,,Sonstige Texte,,Deutsch,,,M:Quart,
AK01319507,Buch,"Altendorf, Wolfgang (1921-2007) [Verfasser/Urheber]","Altendorf, Irmeli [Herausgeber]","Metamorphosen : (französische Komödie aus dem Zyklus ""Europäische Komödie""). - 1.","Altendorf, Wolfgang; Altendorf, Irmeli","Freudenstadt-Wittlensweiler : Altendorf, [1994] - 166 Seiten, [1994] - 79 Seiten",,,,,,,,[1994],1994,,79 Seiten,,,1,,,,,Deutsch,,,,
AK01339932,Buch,"Altendorf, Wolfgang (1921-2007) [Verfasser/Urheber]","Altendorf, Irmeli [Herausgeber]␟Altendorf, Wolfgang (1921-2007) [Illustrator]","Poetical Berlin 1990 - Bibliophile Sonderausg., handmade-Ausg.","Altendorf, Wolfgang; Altendorf, Irmeli; Altendorf, Wolfgang","Freudenstadt : Altendorf, [1990] - [30] Seiten",Altendorf,Poetical Berlin 1990,,Wolfgang Altendorf. Zeichn. von Wolfgang Altendorf. Hrsg. von Irmeli Altendorf,"Bibliophile Sonderausg., handmade-Ausg.",Freudenstadt,Altendorf,[1990],1990,,[30] Seiten,Ill.,,,Doppelblattfalz,,Nichttextuelle Produktion␟Lyrik,,Deutsch,,,M,
AK00188049,Buch,"Altendorf, Wolfgang (1921-2007) [Verfasser/Urheber]","Altendorf, Irmeli [Herausgeber]","Zwischen den Fronten : wie verhalte ich mich in Kriegsregionen? ; Erfahrungstips für Korrespondenten, Helfern huminitärer Institutionen, Delegationen, Touristen - Handmade-Ausg., bibliophile Sonderausg.","Altendorf, Wolfgang; Altendorf, Irmeli","Freudenstadt : Altendorf-Kulturstiftung, [1994] - 50 Seiten [Doppelblattfalz]",Altendorf,Zwischen den Fronten,"wie verhalte ich mich in Kriegsregionen? ; Erfahrungstips für Korrespondenten, Helfern huminitärer Institutionen, Delegationen, Touristen",Wolfgang Altendorf. Hrsg. von Irmeli Altendorf,"Handmade-Ausg., bibliophile Sonderausg.",Freudenstadt,Altendorf-Kulturstiftung,[1994],1994,,50 Seiten [Doppelblattfalz],,Humanwissenschaftliche Schriften,,,3-921061-73-3,,,Deutsch,,,M,
AK01351419,Buch,"Althaus, Peter Paul (1892-1965) [Verfasser/Urheber]","Althaus, Hans [Herausgeber]",Vom Send zum Monopteross : Gedichte und Prosa : 1921-1949 : [Werke Sammlung],"Althaus, Peter Paul; Althaus, Hans","München : Allitera Verlag, Dezember 2011 - 130 Seiten",Buch & Medi@ GmbH,Vom Send zum Monopteross,Gedichte und Prosa : 1921-1949,Peter Paul Althaus ; herausgegeben von Hans Althaus,,München,Allitera Verlag,Dezember 2011,2011,,130 Seiten,,Edition Monacensia,,,978-3-86906-173-3,Lyrik␟Erzählende Prosa␟Sonstige Texte,Werke Sammlung,Deutsch,,,L,
AK00195701,Buch,"Altmann, Gerhard (1966-) [Verfasser/Urheber]",,Sim Sala Mander : Lyrik,"Altmann, Gerhard","Wien ; Linz ; Weitra ; München : Publikation P No 1 - Bibliothek der Provinz, [1997?] - 82 Seiten","Publ. P No 1, Bibliothek der Provinz",Sim Sala Mander,Lyrik,Gerhard Altmann,,Wien ; Linz ; Weitra ; München,Publikation P No 1 - Bibliothek der Provinz,[1997?],1997,,82 Seiten,,,,,3-85252-183-4,,,Deutsch,,,N,
AK01735877,Buch,"Altmann, Peter Simon (1968-) [Verfasser/Urheber]","Ziegler, Michael (1960-) [Illustrator]␟Raditschnig, Werner (1948-) [Komponist]",Dichterliebe - [Band],"Altmann, Peter Simon; Ziegler, Michael; Raditschnig, Werner","Salzburg ; Wien : Edition Tandem, 2015 - 58 ungezählte Seiten",,[Band],,,,,,2015,2015,,58 ungezählte Seiten,Illustrationen,,,,978-3-902932-35-8,Lyrik,,Deutsch,,,N,
AK01028260,Buch␟Buchumschlag,"Altwegg, Jürg (1951-) [Verfasser/Urheber]",,¬Die¬ Republik des Geistes : Frankreichs Intellektuelle zwischen Revolution und Reaktion - [1. - 4. Tsd],"Altwegg, Jürg","München [u.a.] : Piper, 1986 - 397 Seiten",Piper,Die Republik des Geistes,Frankreichs Intellektuelle zwischen Revolution und Reaktion,Jürg Altwegg,[1. - 4. Tsd],München [u.a.],Piper,1986,1986,,397 Seiten,,,,,3-492-02634-6,,,Deutsch,,,QD1,
AK00203667,Mikroform␟Buch,"Alvensleben, Ludwig von (1800-1868) [Verfasser/Urheber]",,¬Der¬ Rachegeist oder die Strafe des Brudermordes : e. Roman - [Mikrofiche-Ausg.],"Alvensleben, Ludwig von","Meissen : Goedsche, 1830 - 312 Seiten",Goedsche,Der Rachegeist oder die Strafe des Brudermordes,e. Roman,von Clodwig,[Mikrofiche-Ausg.],Meissen,Goedsche,1830,1830,,312 Seiten,,,,"Mikrofiche-Ausg.: Wildberg : Belser Wiss. Dienst, 1989 - 1990. (Edition Corvey)",3-628-37124-4,,,Deutsch,,,MPF Corvey <3-628-37124-4>,
