AK01722904,Buch,"Haas, Rudolf (1877-1943) [Verfasser/Urheber]","Adler, Friedrich [Widmungsempfänger]",¬Der¬ Volksbeglücker : Roman - Zweite Auflage,"Haas, Rudolf; Adler, Friedrich","Berlin-Charlottenburg : Axel Juncker Verlag, © 1910 - 391 Seiten",Juncker,Der Volksbeglücker,Roman,von Rudolf Haas,Zweite Auflage,Berlin-Charlottenburg,Axel Juncker Verlag,© 1910,1910,,391 Seiten,,,,In Fraktur␟Mit gedruckter Widmung an Friedrich Adler,,Erzählende Prosa,,Deutsch,,,L,
AK01422942,Buch,"Haas, Rudolf (1877-1943) [Verfasser/Urheber]",,Freude am Schönen : Gedanken über ein nicht nur ästhetisches Thema,"Haas, Rudolf","Hamburg : Kath. Akad., 1992 - 50 Seiten",Kath. Akad. Hamburg,Freude am Schönen,Gedanken über ein nicht nur ästhetisches Thema,Rudolf Haas. [Katholische Akademie Hamburg],,Hamburg,Kath. Akad.,1992,1992,,50 Seiten,,Reihe Akademiebibliothek ; Bd. 1,1,,3-928750-01-1,,,Deutsch,,,MJB4,
AK00570245,Buch,"Haas, Willy (1891-1973) [Verfasser/Urheber]",,[Weltblick] Calibans Weltblick,"Haas, Willy","Hamburg : Broschek, 1957 - 101 Seiten",Broschek,Calibans Weltblick,,Caliban. Mit e. Vorw. von Willy Haas. Zeichn.: Wilhelm M. Busch ; Mirko Szewzuk,,Hamburg,Broschek,1957,1957,,101 Seiten,,,,Pp. : 5.80,,,,Deutsch,,Weltblick,Le2:H/Haa,
AK01174806,Buch,"Haase, Carl (1758-1810) [Verfasser/Urheber]",,Karl Philipp Moritz und die Stadt Hannover : [Sonderdruck],"Haase, Carl","[S.l.], [1981] - Seiten 213 - 321",,Karl Philipp Moritz und die Stadt Hannover,,Carl Haase,,[S.l.],,[1981],1981,,Seiten 213 - 321,,,,,,,Sonderdruck,,,"Aus: Hannoversche Geschichtsblätter ; N.F. ; 35 [1981], H. 3 - 4",HH:Kps.␟HH:Kps.,
AK00966696,Buch,"Haasis, Hellmut G. (1942-) [Verfasser/Urheber]",,"¬Den¬ Hitler jag ich in die Luft : der Attentäter Georg Elser - Vollst. neu vom Autor überarb. Ausg., Erstausg., 1. Aufl.","Haasis, Hellmut G.","Hamburg : Ed. Nautilus, 2009 - 383 Seiten","Ed. Nautilus, Schulenburg",Den Hitler jag ich in die Luft,der Attentäter Georg Elser,Hellmut G. Haasis,"Vollst. neu vom Autor überarb. Ausg., Erstausg., 1. Aufl.",Hamburg,Ed. Nautilus,2009,2009,,383 Seiten,Ill.,,,,978-3-89401-606-7,Sonstige Texte,,Deutsch,,,M,
AK00366345,Buch,"Haasis, Hellmut G. (1942-) [Verfasser/Urheber]",,Georg Elser bei der Gestapo : ein Stück mit 20 Szenen ; schwäbisch - 2. Aufl. : [Mundarttext],"Haasis, Hellmut G.","Paris ; Strasbourg ; Basel ; Reutlingen ; Praha ; Yerushalajim : Freiheitsbaum, 2007 - 56 Seiten",Verl. Der Freiheitsbaum,Georg Elser bei der Gestapo,ein Stück mit 20 Szenen ; schwäbisch,von Hellmut G. Haasis,2. Aufl.,Paris ; Strasbourg ; Basel ; Reutlingen ; Praha ; Yerushalajim,Freiheitsbaum,2007,2007,,56 Seiten,,,1,Text in deutscher Sprache und schwäbischer Mundart,3-922589-31-6␟978-3-922589-31-0,Dramatisches,Mundarttext,Deutsch␟Deutsche Dialekte,,,M,
AK00116290,Buch␟Buchumschlag,"Habasch, Hussein (1948-) [Verfasser/Urheber]",,¬Die¬ Mandelbäume verbrennen ihre Früchte : Gedichte - 1. Aufl.,"Habasch, Hussein","Sankt Augustin : Avlos, 1998 - 94 Seiten",Avlos Verl.,Die Mandelbäume verbrennen ihre Früchte,Gedichte,Hussein Habasch,1. Aufl.,Sankt Augustin,Avlos,1998,1998,,94 Seiten,,,,,3-929634-37-6,Lyrik,,Deutsch,,,N,
AK00570274,Buch,"Habe, Hans (1911-1977) [Verfasser/Urheber]",,Ob tausend fallen,"Habe, Hans","Stuttgart : Rowohlt, 1947 - 405 Seiten",Rowohlt,Ob tausend fallen,,Hans Habe,,Stuttgart,Rowohlt,1947,1947,,405 Seiten,,,,,,,,Deutsch,,,L,
AK01486450,Buch,"Habermann, Inge (1912-2006) [Verfasser/Urheber]",,Gedichte 1989 - 1995,"Habermann, Inge","Aalen : Habermann, 1996 - 187 Seiten",Habermann,Gedichte 1989 - 1995,,Inge Habermann,,Aalen,Habermann,1996,1998,,187 Seiten,,,,,,Lyrik,,Deutsch,,,M,
AK00016483,Buch,"Hacke, Axel (1956-) [Verfasser/Urheber]","Herrenberger, Marcus (1955-) [Illustrator]",¬Der¬ kleine Erziehungsberater - 2. Aufl.,"Hacke, Axel; Herrenberger, Marcus","München : Kunstmann, 1992 - 114 Seiten",Kunstmann,Der kleine Erziehungsberater,,Axel Hacke. Ill. von Marcus Herrenberger,2. Aufl.,München,Kunstmann,1992,1992,,114 Seiten,Ill.,,,,3-88897-056-3,,,Deutsch,,,N,
AK00155862,Buch␟Buchumschlag,"Hacker, Doja (1960-) [Verfasser/Urheber]",,Bin ich böse : Roman,"Hacker, Doja","München ; Zürich : Piper, 2002 - 198 Seiten",Piper,Bin ich böse,Roman,Doja Hacker,,München ; Zürich,Piper,2002,2002,,198 Seiten,,,,,3-492-04393-3,Erzählende Prosa,,Deutsch,,,N,
AK01340534,Buch␟Buchumschlag,"Hackl, Erich (1954-) [Verfasser/Urheber]",,Dieses Buch gehört meiner Mutter,"Hackl, Erich","Zürich : Diogenes, 2013 - 116 Seiten",Diogenes,Dieses Buch gehört meiner Mutter,,Erich Hackl,,Zürich,Diogenes,2013,2013,,116 Seiten,,,,,978-3-257-06866-5␟3-257-06866-2,Erzählende Prosa,,Deutsch,,,M,
AK00832576,Mehrteiliges Werk,"Hacks, Peter (1928-2003) [Verfasser/Urheber]",,Ausgewählte Dramen : [Werke Sammlung],"Hacks, Peter",Berlin ; Weimar : Aufbau-Verl.,Aufbau-Verl.,Ausgewählte Dramen,,Peter Hacks,,Berlin ; Weimar,Aufbau-Verl.,,,,,,,,,,Dramatisches,Werke Sammlung,Deutsch,,,,M (Teils.:1972)
AK00570688,Buch,"Haecker, Hans-Joachim (1910-1994) [Verfasser/Urheber]",Michelangelo <Buonarroti> (1475-1564) [Verfasser],Werke Michelangelos,"Haecker, Hans-Joachim; Michelangelo <Buonarroti>","München : Graphikum Mock, 1975 - [36] Seiten",Verl. Graphikum,Werke Michelangelos,,Sonette von Hans-Joachim Haecker,,München,Graphikum Mock,1975,1975,,[36] Seiten,Ill.,Dichter und Zeichner ; 14,14,engl. brosch. : DM 12.50,3-921105-30-7,,,Deutsch,,,L,
AK00137748,Buch,"Haefs, Gisbert (1950-) [Verfasser/Urheber]",,Andalusischer Abgang : Roman,"Haefs, Gisbert","Reinbek bei Hamburg : Rowohlt-Taschenbuch-Verl., 2000 - 190 Seiten",Rowohlt-Taschenbuch-Verl.,Andalusischer Abgang,Roman,Gisbert Haefs,,Reinbek bei Hamburg,Rowohlt-Taschenbuch-Verl.,2000,2000,,190 Seiten,,rororo ; 22816,22816,,3-499-22816-5,,,Deutsch,,,,
AK00030985,Buch␟Buchumschlag,"Haefs, Gisbert (1950-) [Verfasser/Urheber]",,Hamilkars Garten,"Haefs, Gisbert","München : Heyne, 1999 - 303 Seiten",Heyne,Hamilkars Garten,,Gisbert Haefs,,München,Heyne,1999,1999,,303 Seiten,,,,,3-453-14299-3,Erzählende Prosa,,Deutsch,,,M,
AK01605005,Buch,"Haehling von Lanzenauer, Reiner (1928-) [Verfasser/Urheber]",,¬Das¬ Gottesurteil bei Victor von Scheffel : [Sonderdruck],"Haehling von Lanzenauer, Reiner","Karlsruhe : Verlag der Gesellshcaft für Kulturhistorische Dokumentation, 2018 - 11 ungezählte Seiten",Verl. der Ges. für Kulturhistorische Dokumentation,Das Gottesurteil bei Victor von Scheffel,,Reiner Haehling von Lanzenauer,,Karlsruhe,Verlag der Gesellshcaft für Kulturhistorische Dokumentation,2018,2018,,11 ungezählte Seiten,,,,"Sonderdruck aus: Rechtshistorische und andere Rundgänge. Festschrift für Detlev Fischer. 2018, Seite 219 - 228.",,Sonstige Texte,Sonderdruck,Deutsch,,,M:Kps.,
AK01232924,Buch,"Haehling von Lanzenauer, Reiner (1928-) [Verfasser/Urheber]",,Otto Flake in Baden-Baden - Sonderdr. : [Sonderdruck],"Haehling von Lanzenauer, Reiner","[Baden-Baden] : Selbstverl. Haehling von Lanzenauer, 2010 - Seiten 677-684",Selbstverl. Haehling von Lanzenauer,Otto Flake in Baden-Baden,,Reiner Haehling von Lanzenauer,Sonderdr.,[Baden-Baden],Selbstverl. Haehling von Lanzenauer,2010,2010,,Seiten 677-684,Ill.,,,,,Sonstige Texte,Sonderdruck,Deutsch,,"Aus: Badische Heimat 99 (2010), 3",M:Kps.,
AK00570730,Buch,"Haering, Theodor (1884-1964) [Verfasser/Urheber]",,Von ewigen Dingen : Betrachtungen,"Haering, Theodor","Stuttgart : Strecker u. Schröder, 1923 - 92 Seiten",Strecker und Schröder,Von ewigen Dingen,Betrachtungen,von Th. Haering d.Ae.,,Stuttgart,Strecker u. Schröder,1923,1923,,92 Seiten,,,,#NV␟In Fraktur,,,,Deutsch,,,L,
AK00014183,Buch,"Häfner, Eberhard (1941-) [Verfasser/Urheber]",,¬Die¬ Verelfung der Zwölf : Prosa - 1. Aufl.,"Häfner, Eberhard","Berlin ; Weimar : Aufbau-Verl., 1990 - 100 Seiten",Aufbau-Verl.,Die Verelfung der Zwölf,Prosa,Eberhard Häfner,1. Aufl.,Berlin ; Weimar,Aufbau-Verl.,1990,1990,,100 Seiten,,,,,3-351-01737-5,,,Deutsch,,,M,
AK00985481,Buch,"Hafner, Philipp (1731-1764) [Verfasser/Urheber]","Haufe, Eberhard (1931-2013) [Herausgeber]",Hannswurstische Träume,"Hafner, Philipp; Haufe, Eberhard","Weimar : Kiepenheuer, 1973 - 166 Seiten",Kiepenheuer,Hannswurstische Träume,,Philipp Hafner. [Nach Orig.-Dr. von 1763 und1764 hrsg. von Eberhard Haufe. Mit Ill. von Karl-Georg Hirsch],,Weimar,Kiepenheuer,1973,1973,,166 Seiten,Ill.,,,,,,,Deutsch,,,G,
AK00404365,Buch,"Hafner, Tobias (1833-1921) [Verfasser/Urheber]",,¬Das¬ Kaiserfest in Stuttgart im September 1876 : in zierlichen Reimen in oberschwäbischer Mundart beschrieben,"Hafner, Tobias","Stuttgart : Rupfer, [s.a.] - o.A.",Rupfer,Das Kaiserfest in Stuttgart im September 1876,in zierlichen Reimen in oberschwäbischer Mundart beschrieben,von Sebastian Spundle,,Stuttgart,Rupfer,[s.a.],,,o.A.,,,,,,,,,,,K:Kps.␟K,
AK00163166,Buch,"Hagemann, Friedrich (1934-) [Verfasser/Urheber]",,Ich bin rational wie nur einer : Alfred Döblin - eine Annäherung,"Hagemann, Friedrich","Berlin, 1998 - 27 Seiten",,Ich bin rational wie nur einer,Alfred Döblin - eine Annäherung,von Hans-Georg Mann,,Berlin,,1998,1998,,27 Seiten,,,"98,2",,,,,Deutsch,,,M:Kps.,
AK00814874,Buch␟Buchumschlag,"Hahn, Anna Katharina (1970-) [Verfasser/Urheber]",,Kürzere Tage : Roman - 1. Aufl.,"Hahn, Anna Katharina","Frankfurt am Main : Suhrkamp, 2009 - 223 Seiten",Suhrkamp,Kürzere Tage,Roman,Anna Katharina Hahn,1. Aufl.,Frankfurt am Main,Suhrkamp,2009,2009,,223 Seiten,,,,,978-3-518-42057-7,Erzählende Prosa,,Deutsch,,,N,
AK00385798,Buch,"Hahn, Erwin (1887-) [Verfasser/Urheber]",,¬Der¬ letzte Mensch : ein Beitrag zur Eschatologie in der neueren Dichtung : [Hochschulschrift],"Hahn, Erwin","Wien, 1936 - 95 Seiten",,Der letzte Mensch,ein Beitrag zur Eschatologie in der neueren Dichtung,Erwin Hahn,,Wien,,1936,1936,,95 Seiten,,,,"[Masch.]␟Wien, Phil. Fak., Diss., 1936",,,Hochschulschrift,,,,C8,
AK00570901,Buch,"Hahn, Josef [Verfasser/Urheber]",,¬Ein¬ Traum vom Gottesacker,"Hahn, Josef","Ludwigsburg : Ulshöfer, [s.a.] - 16 Seiten",Ulshöfer,Ein Traum vom Gottesacker,,mitget. Joseph Hahn,,Ludwigsburg,Ulshöfer,[s.a.],,,16 Seiten,,,,,,,,,,,L:Kps.,
AK00570922,Buch,"Hahn, Karl (1867-) [Verfasser/Urheber]",,Tiermaskenspiele : von Eitelkeit und Dummheit,"Hahn, Karl","München : Kaiser, 1936 - 51 Seiten",Kaiser,Tiermaskenspiele,von Eitelkeit und Dummheit,von Karl Kahn,,München,Kaiser,1936,1936,,51 Seiten,Ill.,Münchener Laienspiele ; 150,150,#NV␟In Fraktur,,,,Deutsch,,,W,
AK00988950,Buch,"Hahn, Ludwig Philipp (1746-1814) [Verfasser/Urheber]",,Zill und Marte : eine Ballade - [Nachdruck d. Ausg. Zweibrücken 1786],"Hahn, Ludwig Philipp","Leipzig : Zeitler, 1907 - 46 Seiten",Zeitler,Zill und Marte,eine Ballade,von Ludwig Philip Hahn,[Nachdruck d. Ausg. Zweibrücken 1786],Leipzig,Zeitler,1907,1907,,46 Seiten,,,,Faks.-T.,,,,Deutsch,,,H␟Glück:H,
AK01005573,Buch,"Hahn, Otto (1828-1904) [Verfasser/Urheber]",,König Maximilian I. in Reutlingen : ein Volksschauspiel,"Hahn, Otto","Stuttgart : Kohlhammer, 1885 - 142 Seiten",Kohlhammer,König Maximilian I. in Reutlingen,ein Volksschauspiel,Otto Hahn,,Stuttgart,Kohlhammer,1885,1885,,142 Seiten,,,,,,,,,,,I,
AK01284762,Buch,"Hahn, Ulla (1946-) [Verfasser/Urheber]","Fußmann, Klaus (1938-) [Illustrator]␟Anderson, Friedel (1954-) [Illustrator]␟Warwas, Till (1962-) [Illustrator]␟Weber, Wilfried (-2016) [Herausgeber]",Alsterlust : Novelle,"Hahn, Ulla; Fußmann, Klaus; Anderson, Friedel; Warwas, Till; Weber, Wilfried","Hamburg : Jud, 2009 - 61 Seiten",Jud,Alsterlust,Novelle,"Ulla Hahn. Hrsg. von Wilfried Weber. [Mit achtzehn Alsteransichten von Klaus Fußmann, Friedel Anderson, Till Warwas]",,Hamburg,Jud,2009,2009,,61 Seiten,Ill.,,,,978-3-9804142-9-6␟978-3-9813318-0-6,Erzählende Prosa,,Deutsch,,,M:Quart,
AK00108508,Buch,"Hahn-Hahn, Ida (1805-1880) [Verfasser/Urheber]",,Ilda Schönholm - 2. Aufl.,"Hahn-Hahn, Ida","Berlin : Duncker, 1845 - VIII, 236 Seiten",Duncker,Ilda Schönholm,,von Ida Hahn-Hahn,2. Aufl.,Berlin,Duncker,1845,1845,,"VIII, 236 Seiten",,Aus der Gesellschaft ; 1,1,,,Erzählende Prosa,,Deutsch,,,I␟I,
AK00339303,Mikroform␟Buch,"Hahn-Hahn, Ida (1805-1880) [Verfasser/Urheber]",,Ilda Schönholm. 2. Aufl,"Hahn-Hahn, Ida","Berlin, 1845",,Ilda Schönholm. 2. Aufl,,Ida Hahn-Hahn,,Berlin,,1845,1845,,,,,,"DM 259,- (Gesamtpreis für alle Werke des Autors in der Ed., 37 Mikrofiches, ISBN gültig für alle Werke des Autors)␟Mikrofiche-Ausg.␟München [u.a.] : Saur, 1994. Mikrofiche(s). (Bibliothek der deutschen Literatur ; Fiche 19214). Besitzer der Verfilmungsvorlage: 15. - Enth. in BDL-Teilausg.: Restauration, Brandenburg, Reiseliteratur. ISBN 3-598-51062-4 ISBN 3-598-50020-3 ISBN 3-598-50030-0 ISBN 3-598-50115-3",3-598-51062-4␟3-598-50020-3␟3-598-50030-0␟3-598-50115-3,,,,,,MPF BDL 19214,
AK00150798,Buch,"Hahn-Hahn, Ida (1805-1880) [Verfasser/Urheber]",,Levin. - 1.,"Hahn-Hahn, Ida","Berlin : Duncker, 1848 - 320 Seiten",,,,,,,,1848,1848,,320 Seiten,,,1,,,Erzählende Prosa,,Deutsch,,,I,
AK01309482,Buch,"Hajek, Egon (1888-1963) [Verfasser/Urheber]","Wilke, Karl A. (1879-1954) [Illustrator]",Du sollst mein Zeuge sein : Lebenswege eines deutschen Bekenners ; Roman,"Hajek, Egon; Wilke, Karl A.","Graz ; Leipzig : Stocker Verl., [ca. 1940] - 347 Seiten",Stocker,Du sollst mein Zeuge sein,Lebenswege eines deutschen Bekenners ; Roman,von Egon Hajek. Bildschmuck von K. A. Wilke,,Graz ; Leipzig,Stocker Verl.,[ca. 1940],1940,,347 Seiten,Ill.,,,In Fraktur,,Erzählende Prosa,,Deutsch,,,L,
AK00404416,Buch,"Halbe, Max (1865-1944) [Verfasser/Urheber]",,¬Der¬ Frühlingsgarten : 2 Novellen,"Halbe, Max","Augsburg : Kraft, [1965] - 133 Seiten",Kraft,Der Frühlingsgarten,2 Novellen,Max Halbe,,Augsburg,Kraft,[1965],1965,,133 Seiten,,,,Lw. : 9.80,,,,Deutsch,,,K,
AK00350178,Buch,"Halbe, Max (1865-1944) [Verfasser/Urheber]",,¬Die¬ Heimathlosen : Drama in fünf Aufzügen,"Halbe, Max","Berlin : Entsch, 1899 - 94 Seiten",Entsch,Die Heimathlosen,Drama in fünf Aufzügen,Max Halbe,,Berlin,Entsch,1899,1899,,94 Seiten,,,,#NV␟#NV␟Bühnenmanuskript,,,,,,,K:Kps.,
AK01272850,Buch,"Halbe, Max (1865-1944) [Verfasser/Urheber]",,Sämtliche Werke. - 5. Lebenswende. Mutter Erde. Der Eroberer. Die Heimatlosen,"Halbe, Max","Salzburg : Verl. 'Das Bergland-Buch', 1945 - 445 Seiten",,Lebenswende. Mutter Erde. Der Eroberer. Die Heimatlosen,,,,,,1945,1945,,445 Seiten,,,5,,,,,Deutsch,,,K,
AK00187033,Buch,"Halbey, Hans Adolf (1922-2003) [Verfasser/Urheber]",,Karl Klingspor : Leben und Werk ; ein Beitrag zur Geschichte der deutschen Schriftkunst und des Schriftgiessereiwesens im 20. Jahrhundert,"Halbey, Hans Adolf","Offenbach am Main : Klingspor-Museum, 1991 - 205 Seiten",Klingspor-Museum,Karl Klingspor,Leben und Werk ; ein Beitrag zur Geschichte der deutschen Schriftkunst und des Schriftgiessereiwesens im 20. Jahrhundert,"Hans Adolf Halbey. Vereinigung ""Freunde des Klingspor-Museums"" e.V.",,Offenbach am Main,Klingspor-Museum,1991,1991,,205 Seiten,Ill.,,,Literaturverz. S. 204 - 205,,,,Deutsch,,,B2:Quart,
AK01454495,Buch,"Hallinger, Markus (1961-) [Verfasser/Urheber]",,Gesummsel - 1. Aufl.,"Hallinger, Markus","Ostheim/Rhön : Engstler, 2015 - 27 Seiten",Engstler,Gesummsel,,Markus Hallinger,1. Aufl.,Ostheim/Rhön,Engstler,2015,2015,,27 Seiten,,,,,978-3-941126-78-7,Lyrik,,Deutsch,,,N:Kps.Quart,
AK00279587,Buch,"Halm, Friedrich (1806-1871) [Verfasser/Urheber]",,Vor hundert Jahren : Festspiel zur Säcularfeier des Geburtsfestes Schiller's - 2. Aufl.,"Halm, Friedrich","Wien : Gerold, 1859 - 31 Seiten",Gerold,Vor hundert Jahren,Festspiel zur Säcularfeier des Geburtsfestes Schiller's,von Friedrich Halm,2. Aufl.,Wien,Gerold,1859,1859,,31 Seiten,,,,In Fraktur,,Dramatisches,,Deutsch,,,Glück:HH:Kps.␟HH␟I:Kps.,
AK01642163,Mehrteiliges Werk,"Hamann, Johann Georg (1730-1788) [Verfasser/Urheber]","Reibold, Janina (1985-) [Herausgeber]␟Reibold, Janina (1985-) [Verfasser]",Fliegender Brief : historisch-kritische Ausgabe : [Hochschulschrift],"Hamann, Johann Georg; Reibold, Janina; Reibold, Janina","Hamburg : Felix Meiner Verlag, [2018] - 2 Bände",Meiner,Fliegender Brief,historisch-kritische Ausgabe,"Johann Georg Hamann ; mit einer Einführung, Kommentar und Dokumenten zur Entstehungsgeschichte herausgegeben von Janina Reibold",,Hamburg,Felix Meiner Verlag,[2018]␟©  2018,2018,,2 Bände,,Philosophische Bibliothek ; Band 707,Band 707,Band 1 und 2 im gemeinsamen Schuber,978-3-7873-3423-0␟3-7873-3423-8,,Hochschulschrift␟Faksimile,Deutsch,,"Historisch-kritische und kommentierte Neudedition von J.G. Hamanns ""Fliegender Brief""",,
AK00339373,Mikroform␟Buch,"Hamann, Johann Georg (1730-1788) [Verfasser/Urheber]",,Zweifel und Einfälle über ...,"Hamann, Johann Georg","[S.l.], 1776",,Zweifel und Einfälle über ...,,Johann Georg Hamann,,[S.l.],,1776,1776,,,,,,"Druckausg. anonym erschienen␟DM 210,- (Gesamtpreis für alle Werke des Autors in der Ed., 30 Mikrofiches, ISBN gültig für alle Werke des Autors)␟Mikrofiche-Ausg.␟München [u.a.] : Saur, 1994. Mikrofiche(s). (Bibliothek der deutschen Literatur ; Fiche 7372). Besitzer der Verfilmungsvorlage: 19. - Enth. in BDL-Teilausg.: Aufklärung, Ostpreußen/Westpreußen/Posen. ISBN 3-598-51072-1 ISBN 3-598-50015-7 ISBN 3-598-50037-8",3-598-51072-1␟3-598-50015-7␟3-598-50037-8,,,,,,MPF BDL 7372,
AK01005632,Buch,"Hamerling, Robert (1830-1889) [Verfasser/Urheber]",,Sinnen und Minnen : ein Jugendleben in Liedern - 7. Aufl.,"Hamerling, Robert","Hamburg : Richter, 1886 - XIII, 352 Seiten",Richter,Sinnen und Minnen,ein Jugendleben in Liedern,von Robert Hamerling,7. Aufl.,Hamburg,Richter,1886,1886,,"XIII, 352 Seiten",,,,In Fraktur,,,,Deutsch,,,I,
AK00339398,Mikroform␟Buch,"Hamerling, Robert (1830-1889) [Verfasser/Urheber]",,Stationen meiner Lebenspilgerschaft,"Hamerling, Robert","Hamburg, 1889",,Stationen meiner Lebenspilgerschaft,,Robert Hamerling,,Hamburg,,1889,1889,,,,,,"DM 105,- (Gesamtpreis für alle Werke des Autors in der Ed., 15 Mikrofiches, ISBN gültig für alle Werke des Autors)␟Mikrofiche-Ausg.␟München [u.a.] : Saur, 1994. Mikrofiche(s). (Bibliothek der deutschen Literatur ; Fiche 4063/4064). Besitzer der Verfilmungsvorlage: 12. - Enth. in BDL-Teilausg.: Realismus/Naturalismus, Österreich. ISBN 3-598-51074-8 ISBN 3-598-50023-8 ISBN 3-598-50073-4",3-598-51074-8␟3-598-50023-8␟3-598-50073-4,,,,,,MPF BDL 4063/4064,
AK00953595,Buch␟Buchumschlag,"Hammel, Claus (1932-1990) [Verfasser/Urheber]",,Rom oder die zweite Erschaffung der Welt : Komödie - 1. Aufl.,"Hammel, Claus","Berlin [u.a.] : Aufbau-Verl., 1976 - 121 Seiten",Aufbau-Verl.,Rom oder die zweite Erschaffung der Welt,Komödie,Claus Hammel,1. Aufl.,Berlin [u.a.],Aufbau-Verl.,1976,1976,,121 Seiten,,Edition Neue Texte,,,,,,Deutsch,,,M,
AK00195377,Buch,"Hammer, Franz (1908-1985) [Verfasser/Urheber]",,Johannes Kepler : ein Bild seines Lebens und Wirkens,"Hammer, Franz","Stuttgart : Kohlhammer, 1944 - 32 Seiten",Kohlhammer,Johannes Kepler,ein Bild seines Lebens und Wirkens,von Franz Hammer,,Stuttgart,Kohlhammer,1944,1944,,32 Seiten,,Die bunten Hefte für unsere Soldaten ; 86,86,,,,,Deutsch,,,W,
AK00350184,Buch,"Hammer, Joachim Gunter (1950-) [Verfasser/Urheber]",,Noch grünt ein Rauschen : Gedichte - Privatdr.,"Hammer, Joachim Gunter","Graz, 1995 - 31 ungez. Blatt",,Noch grünt ein Rauschen,Gedichte,Joachim Gunter Hammer,Privatdr.,Graz,,1995,1995,,31 ungez. Blatt,,Werkgruppe Lyrik ; 24,24,,,,,,,,W,
AK00953605,Buch,"Hammerl, Elfriede (1945-) [Verfasser/Urheber]",,"Vater-, Mutter- und Geburtstag : drei Erzählungen","Hammerl, Elfriede","Königstein/Ts. : Athenäum-Verlag, 1980 - 148 Seiten",Athenäum-Verl.,"Vater-, Mutter- und Geburtstag",drei Erzählungen,Elfriede Hammerl,,Königstein/Ts.,Athenäum-Verlag,1980,1980,,148 Seiten,,,,engl. brosch. : DM 19.80,3-7610-8101-4,,,Deutsch,,,M,
AK00200271,Buch,"Hammermeister, Kai (1967-) [Verfasser/Urheber]","Crosby, Matthew [Widmungsempfänger]",¬The¬ German aesthetic tradition - 1. publ.,"Hammermeister, Kai; Crosby, Matthew","Cambridge [u.a.] : Cambridge Univ. Press, 2002 - XV, 259 Seiten",Cambridge Univ. Press,The German aesthetic tradition,,Kai Hammermeister,1. publ.,Cambridge [u.a.],Cambridge Univ. Press,2002,2002,,"XV, 259 Seiten",,,,Mit gedr. Widmung an Matthew Crosby,0-521-78065-9␟0-521-78554-5,,,Englisch,,,C3,
AK00339420,Mikroform␟Buch,"Hammer-Purgstall, Joseph von (1774-1856) [Verfasser/Urheber]",,Morgenländisches Kleeblatt,"Hammer-Purgstall, Joseph von","Wien, 1819",,Morgenländisches Kleeblatt,,Joseph von Hammer-Purgstall,,Wien,,1819,1819,,,,,,"DM 721,- (Gesamtpreis für alle Werke des Autors in der Ed., 103 Mikrofiches, ISBN gültig für alle Werke des Autors)␟Mikrofiche-Ausg.␟München [u.a.] : Saur, 1994. Mikrofiche(s). (Bibliothek der deutschen Literatur ; Fiche 2703/2704). Besitzer der Verfilmungsvorlage: 12. - Enth. in BDL-Teilausg.: Restauration, Österreich, Philologie/Geschichte. ISBN 3-598-51077-2 ISBN 3-598-50020-3 ISBN 3-598-50073-4 ISBN 3-598-50136-6",3-598-51077-2␟3-598-50020-3␟3-598-50073-4␟3-598-50136-6,,,,,,MPF BDL 2703/2704,
AK01794025,Buch,"Hammerschmitt, Marcus (1967-) [Verfasser/Urheber]",,"Halbdunkles Licht : Gedichte - Erstausgabe, 1. Auflage","Hammerschmitt, Marcus","Berlin ; Tübingen : Schiler & Mücke, 2022 - 67 Seiten",Verlag Hans Schiler,Halbdunkles Licht,Gedichte,Marcus Hammerschmitt,"Erstausgabe, 1. Auflage",Berlin ; Tübingen,Schiler & Mücke,2022,2022,,67 Seiten,,,,,978-3-89930-448-0,Lyrik,,Deutsch,,,N:Kps.,
AK01267889,Buch,"Hammerstein, Hans von (1881-1947) [Verfasser/Urheber]",,¬Der¬ Wanderer im Abend : Alte und neue Gedichte,"Hammerstein, Hans von","Wien ; Leipzig ; Zürich : Reichner, 1936 - 76 Seiten",Reichner,Der Wanderer im Abend,Alte und neue Gedichte,Hans von Hammerstein,,Wien ; Leipzig ; Zürich,Reichner,1936,1936,,76 Seiten,,Zeitgenössische Dichtung ; Bd. 5,Bd. 5,In Fraktur,,Lyrik,,Deutsch,,,L,
AK01697625,Buch,"Hampe, Johann Christoph (1913-1990) [Verfasser/Urheber]",,Geschrei aus Babylon : zwanzig Erzählungen,"Hampe, Johann Christoph","Hamburg : Friedrich Wittig Verlag, 1961 - 383 Seiten",Wittig,Geschrei aus Babylon,zwanzig Erzählungen,Johann Christoph Hampe,,Hamburg,Friedrich Wittig Verlag,1961,1961,,383 Seiten,,,,,,Erzählende Prosa,,Deutsch,,,M,
AK01350919,Buch,"Handke, Peter (1942-) [Verfasser/Urheber]","Bussink, Gerrit (1944-) [Übersetzer]",¬De¬ linkshandige vrouw : [Übersetzung deutschspr. Literatur],"Handke, Peter; Bussink, Gerrit","Utrecht ; Antwerpen : Bruna, 1977 - 96 Seiten",Bruna,De linkshandige vrouw,,Peter Handke. Vertaald door Gerrit Bussink,,Utrecht ; Antwerpen,Bruna,1977,1977,,96 Seiten,,,,,90-229-7380-8,Erzählende Prosa,Übersetzung deutschspr. Literatur,Niederländisch,Deutsch,Die linskhändige Frau,M,
AK01427984,Buch,"Handke, Peter (1942-) [Verfasser/Urheber]","Bianchi, Bruna (1942-) [Übersetzer]",Breve lettera del lungo addio : romanzo - 1. ed. : [Übersetzung deutschspr. Literatur],"Handke, Peter; Bianchi, Bruna","Milano : Feltrinelli, 1973 - 201 Seiten",Feltrinelli,Breve lettera del lungo addio,romanzo,Peter Handke. [Trad. di Bruna Bianchi],1. ed.,Milano,Feltrinelli,1973,1973,,201 Seiten,Kt.,,212,,,Erzählende Prosa,Übersetzung deutschspr. Literatur,Italienisch,Deutsch,,M,
AK00317414,Buch,"Handke, Peter (1942-) [Verfasser/Urheber]",,Kali : eine Vorwintergeschichte - 1. Aufl.,"Handke, Peter","Frankfurt am Main : Suhrkamp, 2007 - 160 Seiten",Suhrkamp,Kali,eine Vorwintergeschichte,Peter Handke,1. Aufl.,Frankfurt am Main,Suhrkamp,2007,2007,,160 Seiten,,,,,978-3-518-41877-2␟3-518-41877-7,Erzählende Prosa,,Deutsch,,,M,
AK01351610,Buch␟Buchumschlag,"Handke, Peter (1942-) [Verfasser/Urheber]","Roloff, Michael (1937-2019) [Übersetzer]",Kaspar - 1. publ. : [Übersetzung deutschspr. Literatur],"Handke, Peter; Roloff, Michael","London : Eyre Methuen, 1972 - 99 Seiten",Methuen,Kaspar,,Peter Handke. Transl. by Michael Roloff,1. publ.,London,Eyre Methuen,1972,1972,,99 Seiten,,A Methuen modern play,,,413-28900-1␟413-28910-9,Dramatisches,Übersetzung deutschspr. Literatur,Englisch,Deutsch,,M,
AK01345324,Buch␟Buchumschlag,"Handke, Peter (1942-) [Verfasser/Urheber]","Mannila, Markku (1938-) [Übersetzer]",Poissa : satu : [Übersetzung deutschspr. Literatur],"Handke, Peter; Mannila, Markku","Helsinki : Otava, 1991 - 116 Seiten",Kustannusosakeyhtiö Otava,Poissa,satu,Peter Handke. Suomentanut Markku Mannila,,Helsinki,Otava,1991,1991,,116 Seiten,,,,,951-1-10531-0,Erzählende Prosa,Übersetzung deutschspr. Literatur,Finnisch,Deutsch,,M,
AK00953700,Buch,"Handke, Peter (1942-) [Verfasser/Urheber]","Borovnik, Silvija [Übersetzer]␟Olof, Klaus Detlef (1939-) [Übersetzer]",Ponovitev,"Handke, Peter; Borovnik, Silvija; Olof, Klaus Detlef","[Klagenfurt] : Wieser, 1988 - 230 Seiten",Wieser,Ponovitev,,Peter Handke. Iz nemščine prev. Silvija Borovnik in Klaus Detlev Olof,,[Klagenfurt],Wieser,1988,1988,,230 Seiten,,,,,,,,,,,M,
AK00953632,Buch,"Handke, Peter (1942-) [Verfasser/Urheber]",,Wind und Meer : vier Hörspiele,"Handke, Peter","Frankfurt am Main : Suhrkamp, 1970 - 127 Seiten",Suhrkamp,Wind und Meer,vier Hörspiele,Peter Handke,,Frankfurt am Main,Suhrkamp,1970,1970,,127 Seiten,,Edition Suhrkamp ; 431,431,,,,,Deutsch,,,W,
AK00703083,Buch,"Hannemann, Uli (1965-) [Verfasser/Urheber]",,"Neulich in Neukölln : Notizen von der Talsohle des Lebens - Orig.-Ausg., 6. Aufl.","Hannemann, Uli","Berlin : Ullstein, 2008 - 184 Seiten",Ullstein <ab 1946>,Neulich in Neukölln,Notizen von der Talsohle des Lebens,Uli Hannemann,"Orig.-Ausg., 6. Aufl.",Berlin,Ullstein,2008,2008,,184 Seiten,,Ullstein-Taschenbuch ; 26818,26818,,978-3-548-26818-7,Erzählende Prosa,,Deutsch,,,N,
